Sheet: directory
A1: 链接 | B1: 说明
A2: String | B2: String
A3: href | B3: description
A4: weights | B4: 各种动物出现的可能性(权重)
A5: x | B5: 各种动物得分倍率
A6: const | B6: 游戏系统常量
A7: messages | B7: 系统消息
A8: recharge | B8: 充值表
A9: marketplace | B9: 商城
A10: goods | B10: 物品表

Sheet: weights
A1: 标识 | B1: 所属大类 | C1: 类型 | D1: 说明 | E1: 机器人下注权重 | F1: 倍率1 | G1: 倍率2 | H1: 倍率3 | I1: 倍率4 | J1: 倍率5 | K1: 倍率6 | L1: p1 | M1: p2 | N1: p3 | O1: p4 | P1: p5 | Q1: p6 | R1: 回报率1 | S1: 回报率2 | T1: 回报率3 | U1: 回报率4 | V1: 回报率5 | W1: 回报率6 | X1: 概率 | Y1: 概率 | Z1: 权重-档位-随机编号 | AA1: 权重-档位-随机编号 | AB1: 权重-档位-随机编号 | AC1: 权重-档位-随机编号 | AD1: 权重-档位-随机编号 | AE1: 权重-档位-随机编号 | AF1: 权重-档位-随机编号 | AG1: 权重-档位-随机编号 | AH1: 权重-档位-随机编号 | AI1: 权重-档位-随机编号 | AJ1: 权重-档位-随机编号 | AK1: 权重-档位-随机编号 | AL1: 权重-档位-随机编号 | AM1: 权重-档位-随机编号 | AN1: 权重-档位-随机编号 | AO1: 权重-档位-随机编号 | AP1: 权重-档位-随机编号 | AQ1: 权重-档位-随机编号 | AR1: 权重-档位-随机编号 | AS1: 权重-档位-随机编号 | AT1: 权重-档位-随机编号 | AU1: 权重-档位-随机编号 | AV1: 权重-档位-随机编号 | AW1: 权重-档位-随机编号 | AX1: 权重-档位-随机编号 | AY1: 权重-档位-随机编号 | AZ1: 权重-档位-随机编号 | BA1: 权重-档位-随机编号 | BB1: 权重-档位-随机编号 | BC1: 权重-档位-随机编号 | BD1: 权重-档位-随机编号 | BE1: 权重-档位-随机编号 | BF1: 权重-档位-随机编号 | BG1: 权重-档位-随机编号 | BH1: 权重-档位-随机编号 | BI1: 权重-档位-随机编号 | BJ1: 权重-档位-随机编号 | BK1: 权重-档位-随机编号 | BL1: 权重-档位-随机编号 | BM1: 权重-档位-随机编号 | BN1: 权重-档位-随机编号 | BO1: 权重-档位-随机编号 | BP1: 权重-档位-随机编号 | BQ1: 权重-档位-随机编号 | BR1: 权重-档位-随机编号 | BS1: 权重-档位-随机编号
A2: int | B2: String | C2: String | D2: String | E2: int | F2: int | G2: int | H2: int | I2: int | J2: int | K2: int | L2: double | M2: double | N2: double | O2: double | P2: double | Q2: double | R2: double | S2: double | T2: double | U2: double | V2: double | W2: double | X2: double | Y2: double | Z2: int | AA2: int | AB2: int | AC2: int | AD2: int | AE2: int | AF2: int | AG2: int | AH2: int | AI2: int | AJ2: int | AK2: int | AL2: int | AM2: int | AN2: int | AO2: int | AP2: int | AQ2: int | AR2: int | AS2: int | AT2: int | AU2: int | AV2: int | AW2: int | AX2: int | AY2: int | AZ2: int | BA2: int | BB2: int | BC2: int | BD2: int | BE2: int | BF2: int | BG2: int | BH2: int | BI2: int | BJ2: int | BK2: int | BL2: int | BM2: int | BN2: int | BO2: int | BP2: int | BQ2: int | BR2: int | BS2: int
A3: id | B3: categray | C3: type | D3: dsc | E3: robotWeight | F3: x1 | G3: x2 | H3: x3 | I3: x4 | J3: x5 | K3: x6 | L3: p1 | M3: p2 | N3: p3 | O3: p4 | P3: p5 | Q3: p6 | R3: kl1 | S3: kl2 | T3: kl3 | U3: kl4 | V3: kl5 | W3: kl6 | X3: tempProbablility | Y3: probability | Z3: weight-1-1 | AA3: weight-1-2 | AB3: weight-1-3 | AC3: weight-1-4 | AD3: weight-1-5 | AE3: weight-1-6 | AF3: weight-2-1 | AG3: weight-2-2 | AH3: weight-2-3 | AI3: weight-2-4 | AJ3: weight-2-5 | AK3: weight-3-1 | AL3: weight-3-2 | AM3: weight-3-3 | AN3: weight-3-4 | AO3: weight-3-5 | AP3: weight-4-1 | AQ3: weight-4-2 | AR3: weight-4-3 | AS3: weight-4-4 | AT3: weight-4-5 | AU3: weight-5-1 | AV3: weight-5-2 | AW3: weight-5-3 | AX3: weight-5-4 | AY3: weight-5-5 | AZ3: weight-6-1 | BA3: weight-6-2 | BB3: weight-6-3 | BC3: weight-6-4 | BD3: weight-6-5 | BE3: weight-7-1 | BF3: weight-7-2 | BG3: weight-7-3 | BH3: weight-7-4 | BI3: weight-7-5 | BJ3: weight-8-1 | BK3: weight-8-2 | BL3: weight-8-3 | BM3: weight-8-4 | BN3: weight-8-5 | BO3: weight-9-1 | BP3: weight-9-2 | BQ3: weight-9-3 | BR3: weight-9-4 | BS3: weight-9-5
A4: 1 | B4: . | C4: B | D4: 银鲨鱼 | E4: 200 | F4: =x!R[1]C[-1] -> 24 | G4: =x!R[1]C[-1] -> 24 | H4: =x!R[1]C[-1] -> 24 | I4: =x!R[1]C[-1] -> 24 | J4: =x!R[1]C[-1] -> 24 | K4: =x!R[1]C[-1] -> 24 | L4: =RC[14]/SUM(C[14]) -> 0.00224427120245689 | M4: =RC[14]/SUM(C[14]) -> 0.00197546267415263 | N4: =RC[14]/SUM(C[14]) -> 0.00210130502101305 | O4: =RC[14]/SUM(C[14]) -> 0.00232330643189044 | P4: =RC[14]/SUM(C[14]) -> 0.00197546267415263 | Q4: =RC[14]/SUM(C[14]) -> 0.00210130502101305 | R4: =RC[-12]*RC[-6] -> 0.0538625088589653 | S4: =RC[-12]*RC[-6] -> 0.0474111041796631 | T4: =RC[-12]*RC[-6] -> 0.0504313205043132 | U4: =RC[-12]*RC[-6] -> 0.0557593543653705 | V4: =RC[-12]*RC[-6] -> 0.0474111041796631 | W4: =RC[-12]*RC[-6] -> 0.0504313205043132 | X4: =SUM(R[8]C[1],RC[1],R[14]C[1],R[22]C[1]) -> 0.00897708480982755 | Y4: =RC[1]/SUM(C[1]) -> 0.00224427120245689 | Z4: =13824/RC[-20]-500 -> 76 | AA4: =13824/RC[-20]-500 -> 76 | AB4: =13824/RC[-20]-500 -> 76 | AC4: =13824/RC[-20]-500 -> 76 | AD4: =13824/RC[-20]-500 -> 76 | AE4: =13824/RC[-20]-500 -> 76 | AF4: =RC[-6] -> 76 | AG4: =RC[-6] -> 76 | AH4: =RC[-6] -> 76 | AI4: =RC[-6] -> 76 | AJ4: =RC[-6] -> 76 | AK4: =RC[-5] -> 76 | AL4: =RC[-5] -> 76 | AM4: =RC[-5] -> 76 | AN4: =RC[-5] -> 76 | AO4: =RC[-5] -> 76 | AP4: =RC[-5] -> 76 | AQ4: =RC[-5] -> 76 | AR4: =RC[-5] -> 76 | AS4: =RC[-5] -> 76 | AT4: =RC[-5] -> 76 | AU4: =RC[-5] -> 76 | AV4: =RC[-5] -> 76 | AW4: =RC[-5] -> 76 | AX4: =RC[-5] -> 76 | AY4: =RC[-5] -> 76 | AZ4: =RC[-5] -> 76 | BA4: =RC[-5] -> 76 | BB4: =RC[-5] -> 76 | BC4: =RC[-5] -> 76 | BD4: =RC[-5] -> 76 | BE4: =RC[-5] -> 76 | BF4: =RC[-5] -> 76 | BG4: =RC[-5] -> 76 | BH4: =RC[-5] -> 76 | BI4: =RC[-5] -> 76 | BJ4: =RC[-5] -> 76 | BK4: =RC[-5] -> 76 | BL4: =RC[-5] -> 76 | BM4: =RC[-5] -> 76 | BN4: =RC[-5] -> 76 | BO4: =RC[-5] -> 76 | BP4: =RC[-5] -> 76 | BQ4: =RC[-5] -> 76 | BR4: =RC[-5] -> 76 | BS4: =RC[-5] -> 76
A5: 2 | B5: A | C5: H | D5: 老鹰 | E5: 2000 | F5: =x!R[6]C[-1] -> 24 | G5: =x!R[6]C[-1] -> 24 | H5: =x!R[6]C[-1] -> 24 | I5: =x!R[6]C[-1] -> 12 | J5: =x!R[6]C[-1] -> 24 | K5: =x!R[6]C[-1] -> 24 | L5: =RC[14]/SUM(C[14]) -> 0.0170092133238838 | M5: =RC[14]/SUM(C[14]) -> 0.0149719276356831 | N5: =RC[14]/SUM(C[14]) -> 0.0159256801592568 | O5: =RC[14]/SUM(C[14]) -> 0.0352164343360235 | P5: =RC[14]/SUM(C[14]) -> 0.0149719276356831 | Q5: =RC[14]/SUM(C[14]) -> 0.0159256801592568 | R5: =RC[-12]*RC[-6] -> 0.40822111977321 | S5: =RC[-12]*RC[-6] -> 0.359326263256394 | T5: =RC[-12]*RC[-6] -> 0.382216323822163 | U5: =RC[-12]*RC[-6] -> 0.422597212032282 | V5: =RC[-12]*RC[-6] -> 0.359326263256394 | W5: =RC[-12]*RC[-6] -> 0.382216323822163 | X5: =SUM(RC[1]:R[2]C[1]) -> 0.0510276399716513 | Y5: =RC[1]/SUM(C[1]) -> 0.0170092133238838 | Z5: =13824/RC[-20] -> 576 | AA5: =13824/RC[-20] -> 576 | AB5: =13824/RC[-20] -> 576 | AC5: =13824/RC[-20] -> 1152 | AD5: =13824/RC[-20] -> 576 | AE5: =13824/RC[-20] -> 576 | AF5: =RC[-6] -> 576 | AG5: =RC[-6] -> 576 | AH5: =RC[-6] -> 576 | AI5: =RC[-6] -> 1152 | AJ5: =RC[-6] -> 576 | AK5: =RC[-5] -> 576 | AL5: =RC[-5] -> 576 | AM5: =RC[-5] -> 576 | AN5: =RC[-5] -> 1152 | AO5: =RC[-5] -> 576 | AP5: =RC[-5] -> 576 | AQ5: =RC[-5] -> 576 | AR5: =RC[-5] -> 576 | AS5: =RC[-5] -> 1152 | AT5: =RC[-5] -> 576 | AU5: =RC[-5] -> 576 | AV5: =RC[-5] -> 576 | AW5: =RC[-5] -> 576 | AX5: =RC[-5] -> 1152 | AY5: =RC[-5] -> 576 | AZ5: =RC[-5] -> 576 | BA5: =RC[-5] -> 576 | BB5: =RC[-5] -> 576 | BC5: =RC[-5] -> 1152 | BD5: =RC[-5] -> 576 | BE5: =RC[-5] -> 576 | BF5: =RC[-5] -> 576 | BG5: =RC[-5] -> 576 | BH5: =RC[-5] -> 1152 | BI5: =RC[-5] -> 576 | BJ5: =RC[-5] -> 576 | BK5: =RC[-5] -> 576 | BL5: =RC[-5] -> 576 | BM5: =RC[-5] -> 1152 | BN5: =RC[-5] -> 576 | BO5: =RC[-5] -> 576 | BP5: =RC[-5] -> 576 | BQ5: =RC[-5] -> 576 | BR5: =RC[-5] -> 1152 | BS5: =RC[-5] -> 576
A6: 3 | B6: A | C6: H | D6: 老鹰 | E6: 2000 | F6: =R[-1]C -> 24 | G6: =R[-1]C -> 24 | H6: =R[-1]C -> 24 | I6: =R[-1]C -> 12 | J6: =R[-1]C -> 24 | K6: =R[-1]C -> 24 | L6: =RC[14]/SUM(C[14]) -> 0.0170092133238838 | M6: =RC[14]/SUM(C[14]) -> 0.0149719276356831 | N6: =RC[14]/SUM(C[14]) -> 0.0159256801592568 | O6: =RC[14]/SUM(C[14]) -> 0.0352164343360235 | P6: =RC[14]/SUM(C[14]) -> 0.0149719276356831 | Q6: =RC[14]/SUM(C[14]) -> 0.0159256801592568 | R6: =RC[-12]*RC[-6] -> 0.40822111977321 | S6: =RC[-12]*RC[-6] -> 0.359326263256394 | T6: =RC[-12]*RC[-6] -> 0.382216323822163 | U6: =RC[-12]*RC[-6] -> 0.422597212032282 | V6: =RC[-12]*RC[-6] -> 0.359326263256394 | W6: =RC[-12]*RC[-6] -> 0.382216323822163 | X6: =R[-1]C -> 0.0510276399716513 | Y6: =RC[1]/SUM(C[1]) -> 0.0170092133238838 | Z6: =13824/RC[-20] -> 576 | AA6: =13824/RC[-20] -> 576 | AB6: =13824/RC[-20] -> 576 | AC6: =13824/RC[-20] -> 1152 | AD6: =13824/RC[-20] -> 576 | AE6: =13824/RC[-20] -> 576 | AF6: =RC[-6] -> 576 | AG6: =RC[-6] -> 576 | AH6: =RC[-6] -> 576 | AI6: =RC[-6] -> 1152 | AJ6: =RC[-6] -> 576 | AK6: =RC[-5] -> 576 | AL6: =RC[-5] -> 576 | AM6: =RC[-5] -> 576 | AN6: =RC[-5] -> 1152 | AO6: =RC[-5] -> 576 | AP6: =RC[-5] -> 576 | AQ6: =RC[-5] -> 576 | AR6: =RC[-5] -> 576 | AS6: =RC[-5] -> 1152 | AT6: =RC[-5] -> 576 | AU6: =RC[-5] -> 576 | AV6: =RC[-5] -> 576 | AW6: =RC[-5] -> 576 | AX6: =RC[-5] -> 1152 | AY6: =RC[-5] -> 576 | AZ6: =RC[-5] -> 576 | BA6: =RC[-5] -> 576 | BB6: =RC[-5] -> 576 | BC6: =RC[-5] -> 1152 | BD6: =RC[-5] -> 576 | BE6: =RC[-5] -> 576 | BF6: =RC[-5] -> 576 | BG6: =RC[-5] -> 576 | BH6: =RC[-5] -> 1152 | BI6: =RC[-5] -> 576 | BJ6: =RC[-5] -> 576 | BK6: =RC[-5] -> 576 | BL6: =RC[-5] -> 576 | BM6: =RC[-5] -> 1152 | BN6: =RC[-5] -> 576 | BO6: =RC[-5] -> 576 | BP6: =RC[-5] -> 576 | BQ6: =RC[-5] -> 576 | BR6: =RC[-5] -> 1152 | BS6: =RC[-5] -> 576
A7: 4 | B7: A | C7: H | D7: 老鹰 | E7: 2000 | F7: =R[-2]C -> 24 | G7: =R[-2]C -> 24 | H7: =R[-2]C -> 24 | I7: =R[-2]C -> 12 | J7: =R[-2]C -> 24 | K7: =R[-2]C -> 24 | L7: =RC[14]/SUM(C[14]) -> 0.0170092133238838 | M7: =RC[14]/SUM(C[14]) -> 0.0149719276356831 | N7: =RC[14]/SUM(C[14]) -> 0.0159256801592568 | O7: =RC[14]/SUM(C[14]) -> 0.0352164343360235 | P7: =RC[14]/SUM(C[14]) -> 0.0149719276356831 | Q7: =RC[14]/SUM(C[14]) -> 0.0159256801592568 | R7: =RC[-12]*RC[-6] -> 0.40822111977321 | S7: =RC[-12]*RC[-6] -> 0.359326263256394 | T7: =RC[-12]*RC[-6] -> 0.382216323822163 | U7: =RC[-12]*RC[-6] -> 0.422597212032282 | V7: =RC[-12]*RC[-6] -> 0.359326263256394 | W7: =RC[-12]*RC[-6] -> 0.382216323822163 | X7: =R[-2]C -> 0.0510276399716513 | Y7: =RC[1]/SUM(C[1]) -> 0.0170092133238838 | Z7: =13824/RC[-20] -> 576 | AA7: =13824/RC[-20] -> 576 | AB7: =13824/RC[-20] -> 576 | AC7: =13824/RC[-20] -> 1152 | AD7: =13824/RC[-20] -> 576 | AE7: =13824/RC[-20] -> 576 | AF7: =RC[-6] -> 576 | AG7: =RC[-6] -> 576 | AH7: =RC[-6] -> 576 | AI7: =RC[-6] -> 1152 | AJ7: =RC[-6] -> 576 | AK7: =RC[-5] -> 576 | AL7: =RC[-5] -> 576 | AM7: =RC[-5] -> 576 | AN7: =RC[-5] -> 1152 | AO7: =RC[-5] -> 576 | AP7: =RC[-5] -> 576 | AQ7: =RC[-5] -> 576 | AR7: =RC[-5] -> 576 | AS7: =RC[-5] -> 1152 | AT7: =RC[-5] -> 576 | AU7: =RC[-5] -> 576 | AV7: =RC[-5] -> 576 | AW7: =RC[-5] -> 576 | AX7: =RC[-5] -> 1152 | AY7: =RC[-5] -> 576 | AZ7: =RC[-5] -> 576 | BA7: =RC[-5] -> 576 | BB7: =RC[-5] -> 576 | BC7: =RC[-5] -> 1152 | BD7: =RC[-5] -> 576 | BE7: =RC[-5] -> 576 | BF7: =RC[-5] -> 576 | BG7: =RC[-5] -> 576 | BH7: =RC[-5] -> 1152 | BI7: =RC[-5] -> 576 | BJ7: =RC[-5] -> 576 | BK7: =RC[-5] -> 576 | BL7: =RC[-5] -> 576 | BM7: =RC[-5] -> 1152 | BN7: =RC[-5] -> 576 | BO7: =RC[-5] -> 576 | BP7: =RC[-5] -> 576 | BQ7: =RC[-5] -> 576 | BR7: =RC[-5] -> 1152 | BS7: =RC[-5] -> 576
A8: 5 | B8: . | C8: C | D8: 金鲨鱼 | E8: 100 | F8: =x!R[-2]C[-1] -> 48 | G8: =x!R[-2]C[-1] -> 48 | H8: =x!R[-2]C[-1] -> 48 | I8: =x!R[-2]C[-1] -> 48 | J8: =x!R[-2]C[-1] -> 48 | K8: =x!R[-2]C[-1] -> 48 | L8: =RC[14]/SUM(C[14]) -> 0.00112213560122844 | M8: =RC[14]/SUM(C[14]) -> 0.000987731337076315 | N8: =RC[14]/SUM(C[14]) -> 0.00105065251050653 | O8: =RC[14]/SUM(C[14]) -> 0.00116165321594522 | P8: =RC[14]/SUM(C[14]) -> 0.000987731337076315 | Q8: =RC[14]/SUM(C[14]) -> 0.00105065251050653 | R8: =RC[-12]*RC[-6] -> 0.0538625088589653 | S8: =RC[-12]*RC[-6] -> 0.0474111041796631 | T8: =RC[-12]*RC[-6] -> 0.0504313205043132 | U8: =RC[-12]*RC[-6] -> 0.0557593543653705 | V8: =RC[-12]*RC[-6] -> 0.0474111041796631 | W8: =RC[-12]*RC[-6] -> 0.0504313205043132 | X8: =SUM(RC[1],R[7]C[1],R[14]C[1],R[21]C[1]) -> 0.00448854240491377 | Y8: =RC[1]/SUM(C[1]) -> 0.00112213560122844 | Z8: =13824/RC[-20]-250 -> 38 | AA8: =13824/RC[-20]-250 -> 38 | AB8: =13824/RC[-20]-250 -> 38 | AC8: =13824/RC[-20]-250 -> 38 | AD8: =13824/RC[-20]-250 -> 38 | AE8: =13824/RC[-20]-250 -> 38 | AF8: =RC[-6] -> 38 | AG8: =RC[-6] -> 38 | AH8: =RC[-6] -> 38 | AI8: =RC[-6] -> 38 | AJ8: =RC[-6] -> 38 | AK8: =RC[-5] -> 38 | AL8: =RC[-5] -> 38 | AM8: =RC[-5] -> 38 | AN8: =RC[-5] -> 38 | AO8: =RC[-5] -> 38 | AP8: =RC[-5] -> 38 | AQ8: =RC[-5] -> 38 | AR8: =RC[-5] -> 38 | AS8: =RC[-5] -> 38 | AT8: =RC[-5] -> 38 | AU8: =RC[-5] -> 38 | AV8: =RC[-5] -> 38 | AW8: =RC[-5] -> 38 | AX8: =RC[-5] -> 38 | AY8: =RC[-5] -> 38 | AZ8: =RC[-5] -> 38 | BA8: =RC[-5] -> 38 | BB8: =RC[-5] -> 38 | BC8: =RC[-5] -> 38 | BD8: =RC[-5] -> 38 | BE8: =RC[-5] -> 38 | BF8: =RC[-5] -> 38 | BG8: =RC[-5] -> 38 | BH8: =RC[-5] -> 38 | BI8: =RC[-5] -> 38 | BJ8: =RC[-5] -> 38 | BK8: =RC[-5] -> 38 | BL8: =RC[-5] -> 38 | BM8: =RC[-5] -> 38 | BN8: =RC[-5] -> 38 | BO8: =RC[-5] -> 38 | BP8: =RC[-5] -> 38 | BQ8: =RC[-5] -> 38 | BR8: =RC[-5] -> 38 | BS8: =RC[-5] -> 38
A9: 6 | B9: D | C9: I | D9: 狮子 | E9: 2000 | F9: =x!R[3]C[-1] -> 24 | G9: =x!R[3]C[-1] -> 24 | H9: =x!R[3]C[-1] -> 24 | I9: =x!R[3]C[-1] -> 12 | J9: =x!R[3]C[-1] -> 24 | K9: =x!R[3]C[-1] -> 24 | L9: =RC[14]/SUM(C[14]) -> 0.0170092133238838 | M9: =RC[14]/SUM(C[14]) -> 0.0149719276356831 | N9: =RC[14]/SUM(C[14]) -> 0.0159256801592568 | O9: =RC[14]/SUM(C[14]) -> 0.0352164343360235 | P9: =RC[14]/SUM(C[14]) -> 0.0149719276356831 | Q9: =RC[14]/SUM(C[14]) -> 0.0159256801592568 | R9: =RC[-12]*RC[-6] -> 0.40822111977321 | S9: =RC[-12]*RC[-6] -> 0.359326263256394 | T9: =RC[-12]*RC[-6] -> 0.382216323822163 | U9: =RC[-12]*RC[-6] -> 0.422597212032282 | V9: =RC[-12]*RC[-6] -> 0.359326263256394 | W9: =RC[-12]*RC[-6] -> 0.382216323822163 | X9: =SUM(RC[1]:R[2]C[1]) -> 0.0510276399716513 | Y9: =RC[1]/SUM(C[1]) -> 0.0170092133238838 | Z9: =13824/RC[-20] -> 576 | AA9: =13824/RC[-20] -> 576 | AB9: =13824/RC[-20] -> 576 | AC9: =13824/RC[-20] -> 1152 | AD9: =13824/RC[-20] -> 576 | AE9: =13824/RC[-20] -> 576 | AF9: =RC[-6] -> 576 | AG9: =RC[-6] -> 576 | AH9: =RC[-6] -> 576 | AI9: =RC[-6] -> 1152 | AJ9: =RC[-6] -> 576 | AK9: =RC[-5] -> 576 | AL9: =RC[-5] -> 576 | AM9: =RC[-5] -> 576 | AN9: =RC[-5] -> 1152 | AO9: =RC[-5] -> 576 | AP9: =RC[-5] -> 576 | AQ9: =RC[-5] -> 576 | AR9: =RC[-5] -> 576 | AS9: =RC[-5] -> 1152 | AT9: =RC[-5] -> 576 | AU9: =RC[-5] -> 576 | AV9: =RC[-5] -> 576 | AW9: =RC[-5] -> 576 | AX9: =RC[-5] -> 1152 | AY9: =RC[-5] -> 576 | AZ9: =RC[-5] -> 576 | BA9: =RC[-5] -> 576 | BB9: =RC[-5] -> 576 | BC9: =RC[-5] -> 1152 | BD9: =RC[-5] -> 576 | BE9: =RC[-5] -> 576 | BF9: =RC[-5] -> 576 | BG9: =RC[-5] -> 576 | BH9: =RC[-5] -> 1152 | BI9: =RC[-5] -> 576 | BJ9: =RC[-5] -> 576 | BK9: =RC[-5] -> 576 | BL9: =RC[-5] -> 576 | BM9: =RC[-5] -> 1152 | BN9: =RC[-5] -> 576 | BO9: =RC[-5] -> 576 | BP9: =RC[-5] -> 576 | BQ9: =RC[-5] -> 576 | BR9: =RC[-5] -> 1152 | BS9: =RC[-5] -> 576
A10: 7 | B10: D | C10: I | D10: 狮子 | E10: 2000 | F10: =R[-1]C -> 24 | G10: =R[-1]C -> 24 | H10: =R[-1]C -> 24 | I10: =R[-1]C -> 12 | J10: =R[-1]C -> 24 | K10: =R[-1]C -> 24 | L10: =RC[14]/SUM(C[14]) -> 0.0170092133238838 | M10: =RC[14]/SUM(C[14]) -> 0.0149719276356831 | N10: =RC[14]/SUM(C[14]) -> 0.0159256801592568 | O10: =RC[14]/SUM(C[14]) -> 0.0352164343360235 | P10: =RC[14]/SUM(C[14]) -> 0.0149719276356831 | Q10: =RC[14]/SUM(C[14]) -> 0.0159256801592568 | R10: =RC[-12]*RC[-6] -> 0.40822111977321 | S10: =RC[-12]*RC[-6] -> 0.359326263256394 | T10: =RC[-12]*RC[-6] -> 0.382216323822163 | U10: =RC[-12]*RC[-6] -> 0.422597212032282 | V10: =RC[-12]*RC[-6] -> 0.359326263256394 | W10: =RC[-12]*RC[-6] -> 0.382216323822163 | X10: =R[-1]C -> 0.0510276399716513 | Y10: =RC[1]/SUM(C[1]) -> 0.0170092133238838 | Z10: =13824/RC[-20] -> 576 | AA10: =13824/RC[-20] -> 576 | AB10: =13824/RC[-20] -> 576 | AC10: =13824/RC[-20] -> 1152 | AD10: =13824/RC[-20] -> 576 | AE10: =13824/RC[-20] -> 576 | AF10: =RC[-6] -> 576 | AG10: =RC[-6] -> 576 | AH10: =RC[-6] -> 576 | AI10: =RC[-6] -> 1152 | AJ10: =RC[-6] -> 576 | AK10: =RC[-5] -> 576 | AL10: =RC[-5] -> 576 | AM10: =RC[-5] -> 576 | AN10: =RC[-5] -> 1152 | AO10: =RC[-5] -> 576 | AP10: =RC[-5] -> 576 | AQ10: =RC[-5] -> 576 | AR10: =RC[-5] -> 576 | AS10: =RC[-5] -> 1152 | AT10: =RC[-5] -> 576 | AU10: =RC[-5] -> 576 | AV10: =RC[-5] -> 576 | AW10: =RC[-5] -> 576 | AX10: =RC[-5] -> 1152 | AY10: =RC[-5] -> 576 | AZ10: =RC[-5] -> 576 | BA10: =RC[-5] -> 576 | BB10: =RC[-5] -> 576 | BC10: =RC[-5] -> 1152 | BD10: =RC[-5] -> 576 | BE10: =RC[-5] -> 576 | BF10: =RC[-5] -> 576 | BG10: =RC[-5] -> 576 | BH10: =RC[-5] -> 1152 | BI10: =RC[-5] -> 576 | BJ10: =RC[-5] -> 576 | BK10: =RC[-5] -> 576 | BL10: =RC[-5] -> 576 | BM10: =RC[-5] -> 1152 | BN10: =RC[-5] -> 576 | BO10: =RC[-5] -> 576 | BP10: =RC[-5] -> 576 | BQ10: =RC[-5] -> 576 | BR10: =RC[-5] -> 1152 | BS10: =RC[-5] -> 576
A11: 8 | B11: D | C11: I | D11: 狮子 | E11: 2000 | F11: =R[-2]C -> 24 | G11: =R[-2]C -> 24 | H11: =R[-2]C -> 24 | I11: =R[-2]C -> 12 | J11: =R[-2]C -> 24 | K11: =R[-2]C -> 24 | L11: =RC[14]/SUM(C[14]) -> 0.0170092133238838 | M11: =RC[14]/SUM(C[14]) -> 0.0149719276356831 | N11: =RC[14]/SUM(C[14]) -> 0.0159256801592568 | O11: =RC[14]/SUM(C[14]) -> 0.0352164343360235 | P11: =RC[14]/SUM(C[14]) -> 0.0149719276356831 | Q11: =RC[14]/SUM(C[14]) -> 0.0159256801592568 | R11: =RC[-12]*RC[-6] -> 0.40822111977321 | S11: =RC[-12]*RC[-6] -> 0.359326263256394 | T11: =RC[-12]*RC[-6] -> 0.382216323822163 | U11: =RC[-12]*RC[-6] -> 0.422597212032282 | V11: =RC[-12]*RC[-6] -> 0.359326263256394 | W11: =RC[-12]*RC[-6] -> 0.382216323822163 | X11: =R[-2]C -> 0.0510276399716513 | Y11: =RC[1]/SUM(C[1]) -> 0.0170092133238838 | Z11: =13824/RC[-20] -> 576 | AA11: =13824/RC[-20] -> 576 | AB11: =13824/RC[-20] -> 576 | AC11: =13824/RC[-20] -> 1152 | AD11: =13824/RC[-20] -> 576 | AE11: =13824/RC[-20] -> 576 | AF11: =RC[-6] -> 576 | AG11: =RC[-6] -> 576 | AH11: =RC[-6] -> 576 | AI11: =RC[-6] -> 1152 | AJ11: =RC[-6] -> 576 | AK11: =RC[-5] -> 576 | AL11: =RC[-5] -> 576 | AM11: =RC[-5] -> 576 | AN11: =RC[-5] -> 1152 | AO11: =RC[-5] -> 576 | AP11: =RC[-5] -> 576 | AQ11: =RC[-5] -> 576 | AR11: =RC[-5] -> 576 | AS11: =RC[-5] -> 1152 | AT11: =RC[-5] -> 576 | AU11: =RC[-5] -> 576 | AV11: =RC[-5] -> 576 | AW11: =RC[-5] -> 576 | AX11: =RC[-5] -> 1152 | AY11: =RC[-5] -> 576 | AZ11: =RC[-5] -> 576 | BA11: =RC[-5] -> 576 | BB11: =RC[-5] -> 576 | BC11: =RC[-5] -> 1152 | BD11: =RC[-5] -> 576 | BE11: =RC[-5] -> 576 | BF11: =RC[-5] -> 576 | BG11: =RC[-5] -> 576 | BH11: =RC[-5] -> 1152 | BI11: =RC[-5] -> 576 | BJ11: =RC[-5] -> 576 | BK11: =RC[-5] -> 576 | BL11: =RC[-5] -> 576 | BM11: =RC[-5] -> 1152 | BN11: =RC[-5] -> 576 | BO11: =RC[-5] -> 576 | BP11: =RC[-5] -> 576 | BQ11: =RC[-5] -> 576 | BR11: =RC[-5] -> 1152 | BS11: =RC[-5] -> 576
A12: 9 | B12: . | C12: B | D12: 银鲨鱼 | E12: =R[-8]C -> 200 | F12: =R[-8]C -> 24 | G12: =R[-8]C -> 24 | H12: =R[-8]C -> 24 | I12: =R[-8]C -> 24 | J12: =R[-8]C -> 24 | K12: =R[-8]C -> 24 | L12: =RC[14]/SUM(C[14]) -> 0.00224427120245689 | M12: =RC[14]/SUM(C[14]) -> 0.00197546267415263 | N12: =RC[14]/SUM(C[14]) -> 0.00210130502101305 | O12: =RC[14]/SUM(C[14]) -> 0.00232330643189044 | P12: =RC[14]/SUM(C[14]) -> 0.00197546267415263 | Q12: =RC[14]/SUM(C[14]) -> 0.00210130502101305 | R12: =RC[-12]*RC[-6] -> 0.0538625088589653 | S12: =RC[-12]*RC[-6] -> 0.0474111041796631 | T12: =RC[-12]*RC[-6] -> 0.0504313205043132 | U12: =RC[-12]*RC[-6] -> 0.0557593543653705 | V12: =RC[-12]*RC[-6] -> 0.0474111041796631 | W12: =RC[-12]*RC[-6] -> 0.0504313205043132 | X12: =R[-8]C -> 0.00897708480982755 | Y12: =RC[1]/SUM(C[1]) -> 0.00224427120245689 | Z12: =R[-8]C -> 76 | AA12: =R[-8]C -> 76 | AB12: =R[-8]C -> 76 | AC12: =R[-8]C -> 76 | AD12: =R[-8]C -> 76 | AE12: =R[-8]C -> 76 | AF12: =RC[-6] -> 76 | AG12: =RC[-6] -> 76 | AH12: =RC[-6] -> 76 | AI12: =RC[-6] -> 76 | AJ12: =RC[-6] -> 76 | AK12: =RC[-5] -> 76 | AL12: =RC[-5] -> 76 | AM12: =RC[-5] -> 76 | AN12: =RC[-5] -> 76 | AO12: =RC[-5] -> 76 | AP12: =RC[-5] -> 76 | AQ12: =RC[-5] -> 76 | AR12: =RC[-5] -> 76 | AS12: =RC[-5] -> 76 | AT12: =RC[-5] -> 76 | AU12: =RC[-5] -> 76 | AV12: =RC[-5] -> 76 | AW12: =RC[-5] -> 76 | AX12: =RC[-5] -> 76 | AY12: =RC[-5] -> 76 | AZ12: =RC[-5] -> 76 | BA12: =RC[-5] -> 76 | BB12: =RC[-5] -> 76 | BC12: =RC[-5] -> 76 | BD12: =RC[-5] -> 76 | BE12: =RC[-5] -> 76 | BF12: =RC[-5] -> 76 | BG12: =RC[-5] -> 76 | BH12: =RC[-5] -> 76 | BI12: =RC[-5] -> 76 | BJ12: =RC[-5] -> 76 | BK12: =RC[-5] -> 76 | BL12: =RC[-5] -> 76 | BM12: =RC[-5] -> 76 | BN12: =RC[-5] -> 76 | BO12: =RC[-5] -> 76 | BP12: =RC[-5] -> 76 | BQ12: =RC[-5] -> 76 | BR12: =RC[-5] -> 76 | BS12: =RC[-5] -> 76
A13: 10 | B13: D | C13: J | D13: 熊猫 | E13: 1000 | F13: =x!RC[-1] -> 8 | G13: =x!RC[-1] -> 24 | H13: =x!RC[-1] -> 12 | I13: =x!RC[-1] -> 12 | J13: =x!RC[-1] -> 24 | K13: =x!RC[-1] -> 24 | L13: =RC[14]/SUM(C[14]) -> 0.0510276399716513 | M13: =RC[14]/SUM(C[14]) -> 0.0149719276356831 | N13: =RC[14]/SUM(C[14]) -> 0.0318513603185136 | O13: =RC[14]/SUM(C[14]) -> 0.0352164343360235 | P13: =RC[14]/SUM(C[14]) -> 0.0149719276356831 | Q13: =RC[14]/SUM(C[14]) -> 0.0159256801592568 | R13: =RC[-12]*RC[-6] -> 0.40822111977321 | S13: =RC[-12]*RC[-6] -> 0.359326263256394 | T13: =RC[-12]*RC[-6] -> 0.382216323822163 | U13: =RC[-12]*RC[-6] -> 0.422597212032282 | V13: =RC[-12]*RC[-6] -> 0.359326263256394 | W13: =RC[-12]*RC[-6] -> 0.382216323822163 | X13: =SUM(RC[1]:R[1]C[1]) -> 0.102055279943303 | Y13: =RC[1]/SUM(C[1]) -> 0.0510276399716513 | Z13: =13824/RC[-20] -> 1728 | AA13: =13824/RC[-20] -> 576 | AB13: =13824/RC[-20] -> 1152 | AC13: =13824/RC[-20] -> 1152 | AD13: =13824/RC[-20] -> 576 | AE13: =13824/RC[-20] -> 576 | AF13: =RC[-6] -> 1728 | AG13: =RC[-6] -> 576 | AH13: =RC[-6] -> 1152 | AI13: =RC[-6] -> 1152 | AJ13: =RC[-6] -> 576 | AK13: =RC[-5] -> 1728 | AL13: =RC[-5] -> 576 | AM13: =RC[-5] -> 1152 | AN13: =RC[-5] -> 1152 | AO13: =RC[-5] -> 576 | AP13: =RC[-5] -> 1728 | AQ13: =RC[-5] -> 576 | AR13: =RC[-5] -> 1152 | AS13: =RC[-5] -> 1152 | AT13: =RC[-5] -> 576 | AU13: =RC[-5] -> 1728 | AV13: =RC[-5] -> 576 | AW13: =RC[-5] -> 1152 | AX13: =RC[-5] -> 1152 | AY13: =RC[-5] -> 576 | AZ13: =RC[-5] -> 1728 | BA13: =RC[-5] -> 576 | BB13: =RC[-5] -> 1152 | BC13: =RC[-5] -> 1152 | BD13: =RC[-5] -> 576 | BE13: =RC[-5] -> 1728 | BF13: =RC[-5] -> 576 | BG13: =RC[-5] -> 1152 | BH13: =RC[-5] -> 1152 | BI13: =RC[-5] -> 576 | BJ13: =RC[-5] -> 1728 | BK13: =RC[-5] -> 576 | BL13: =RC[-5] -> 1152 | BM13: =RC[-5] -> 1152 | BN13: =RC[-5] -> 576 | BO13: =RC[-5] -> 1728 | BP13: =RC[-5] -> 576 | BQ13: =RC[-5] -> 1152 | BR13: =RC[-5] -> 1152 | BS13: =RC[-5] -> 576
A14: 11 | B14: D | C14: J | D14: 熊猫 | E14: 1000 | F14: =R[-1]C -> 8 | G14: =R[-1]C -> 24 | H14: =R[-1]C -> 12 | I14: =R[-1]C -> 12 | J14: =R[-1]C -> 24 | K14: =R[-1]C -> 24 | L14: =RC[14]/SUM(C[14]) -> 0.0510276399716513 | M14: =RC[14]/SUM(C[14]) -> 0.0149719276356831 | N14: =RC[14]/SUM(C[14]) -> 0.0318513603185136 | O14: =RC[14]/SUM(C[14]) -> 0.0352164343360235 | P14: =RC[14]/SUM(C[14]) -> 0.0149719276356831 | Q14: =RC[14]/SUM(C[14]) -> 0.0159256801592568 | R14: =RC[-12]*RC[-6] -> 0.40822111977321 | S14: =RC[-12]*RC[-6] -> 0.359326263256394 | T14: =RC[-12]*RC[-6] -> 0.382216323822163 | U14: =RC[-12]*RC[-6] -> 0.422597212032282 | V14: =RC[-12]*RC[-6] -> 0.359326263256394 | W14: =RC[-12]*RC[-6] -> 0.382216323822163 | X14: =R[-1]C -> 0.102055279943303 | Y14: =RC[1]/SUM(C[1]) -> 0.0510276399716513 | Z14: =13824/RC[-20] -> 1728 | AA14: =13824/RC[-20] -> 576 | AB14: =13824/RC[-20] -> 1152 | AC14: =13824/RC[-20] -> 1152 | AD14: =13824/RC[-20] -> 576 | AE14: =13824/RC[-20] -> 576 | AF14: =RC[-6] -> 1728 | AG14: =RC[-6] -> 576 | AH14: =RC[-6] -> 1152 | AI14: =RC[-6] -> 1152 | AJ14: =RC[-6] -> 576 | AK14: =RC[-5] -> 1728 | AL14: =RC[-5] -> 576 | AM14: =RC[-5] -> 1152 | AN14: =RC[-5] -> 1152 | AO14: =RC[-5] -> 576 | AP14: =RC[-5] -> 1728 | AQ14: =RC[-5] -> 576 | AR14: =RC[-5] -> 1152 | AS14: =RC[-5] -> 1152 | AT14: =RC[-5] -> 576 | AU14: =RC[-5] -> 1728 | AV14: =RC[-5] -> 576 | AW14: =RC[-5] -> 1152 | AX14: =RC[-5] -> 1152 | AY14: =RC[-5] -> 576 | AZ14: =RC[-5] -> 1728 | BA14: =RC[-5] -> 576 | BB14: =RC[-5] -> 1152 | BC14: =RC[-5] -> 1152 | BD14: =RC[-5] -> 576 | BE14: =RC[-5] -> 1728 | BF14: =RC[-5] -> 576 | BG14: =RC[-5] -> 1152 | BH14: =RC[-5] -> 1152 | BI14: =RC[-5] -> 576 | BJ14: =RC[-5] -> 1728 | BK14: =RC[-5] -> 576 | BL14: =RC[-5] -> 1152 | BM14: =RC[-5] -> 1152 | BN14: =RC[-5] -> 576 | BO14: =RC[-5] -> 1728 | BP14: =RC[-5] -> 576 | BQ14: =RC[-5] -> 1152 | BR14: =RC[-5] -> 1152 | BS14: =RC[-5] -> 576
A15: 12 | B15: . | C15: C | D15: 金鲨鱼 | E15: =R[-7]C -> 100 | F15: =R[-7]C -> 48 | G15: =R[-7]C -> 48 | H15: =R[-7]C -> 48 | I15: =R[-7]C -> 48 | J15: =R[-7]C -> 48 | K15: =R[-7]C -> 48 | L15: =RC[14]/SUM(C[14]) -> 0.00112213560122844 | M15: =RC[14]/SUM(C[14]) -> 0.000987731337076315 | N15: =RC[14]/SUM(C[14]) -> 0.00105065251050653 | O15: =RC[14]/SUM(C[14]) -> 0.00116165321594522 | P15: =RC[14]/SUM(C[14]) -> 0.000987731337076315 | Q15: =RC[14]/SUM(C[14]) -> 0.00105065251050653 | R15: =RC[-12]*RC[-6] -> 0.0538625088589653 | S15: =RC[-12]*RC[-6] -> 0.0474111041796631 | T15: =RC[-12]*RC[-6] -> 0.0504313205043132 | U15: =RC[-12]*RC[-6] -> 0.0557593543653705 | V15: =RC[-12]*RC[-6] -> 0.0474111041796631 | W15: =RC[-12]*RC[-6] -> 0.0504313205043132 | X15: =R[-7]C -> 0.00448854240491377 | Y15: =RC[1]/SUM(C[1]) -> 0.00112213560122844 | Z15: =R[-7]C -> 38 | AA15: =R[-7]C -> 38 | AB15: =R[-7]C -> 38 | AC15: =R[-7]C -> 38 | AD15: =R[-7]C -> 38 | AE15: =R[-7]C -> 38 | AF15: =RC[-6] -> 38 | AG15: =RC[-6] -> 38 | AH15: =RC[-6] -> 38 | AI15: =RC[-6] -> 38 | AJ15: =RC[-6] -> 38 | AK15: =RC[-5] -> 38 | AL15: =RC[-5] -> 38 | AM15: =RC[-5] -> 38 | AN15: =RC[-5] -> 38 | AO15: =RC[-5] -> 38 | AP15: =RC[-5] -> 38 | AQ15: =RC[-5] -> 38 | AR15: =RC[-5] -> 38 | AS15: =RC[-5] -> 38 | AT15: =RC[-5] -> 38 | AU15: =RC[-5] -> 38 | AV15: =RC[-5] -> 38 | AW15: =RC[-5] -> 38 | AX15: =RC[-5] -> 38 | AY15: =RC[-5] -> 38 | AZ15: =RC[-5] -> 38 | BA15: =RC[-5] -> 38 | BB15: =RC[-5] -> 38 | BC15: =RC[-5] -> 38 | BD15: =RC[-5] -> 38 | BE15: =RC[-5] -> 38 | BF15: =RC[-5] -> 38 | BG15: =RC[-5] -> 38 | BH15: =RC[-5] -> 38 | BI15: =RC[-5] -> 38 | BJ15: =RC[-5] -> 38 | BK15: =RC[-5] -> 38 | BL15: =RC[-5] -> 38 | BM15: =RC[-5] -> 38 | BN15: =RC[-5] -> 38 | BO15: =RC[-5] -> 38 | BP15: =RC[-5] -> 38 | BQ15: =RC[-5] -> 38 | BR15: =RC[-5] -> 38 | BS15: =RC[-5] -> 38
A16: 13 | B16: D | C16: K | D16: 猴子 | E16: 1000 | F16: =x!R[-2]C[-1] -> 6 | G16: =x!R[-2]C[-1] -> 12 | H16: =x!R[-2]C[-1] -> 8 | I16: =x!R[-2]C[-1] -> 8 | J16: =x!R[-2]C[-1] -> 12 | K16: =x!R[-2]C[-1] -> 6 | L16: =RC[14]/SUM(C[14]) -> 0.0680368532955351 | M16: =RC[14]/SUM(C[14]) -> 0.0299438552713662 | N16: =RC[14]/SUM(C[14]) -> 0.0477770404777704 | O16: =RC[14]/SUM(C[14]) -> 0.0528246515040352 | P16: =RC[14]/SUM(C[14]) -> 0.0299438552713662 | Q16: =RC[14]/SUM(C[14]) -> 0.0637027206370272 | R16: =RC[-12]*RC[-6] -> 0.40822111977321 | S16: =RC[-12]*RC[-6] -> 0.359326263256394 | T16: =RC[-12]*RC[-6] -> 0.382216323822163 | U16: =RC[-12]*RC[-6] -> 0.422597212032282 | V16: =RC[-12]*RC[-6] -> 0.359326263256394 | W16: =RC[-12]*RC[-6] -> 0.382216323822163 | X16: =SUM(RC[1]:R[1]C[1]) -> 0.13607370659107 | Y16: =RC[1]/SUM(C[1]) -> 0.0680368532955351 | Z16: =13824/RC[-20] -> 2304 | AA16: =13824/RC[-20] -> 1152 | AB16: =13824/RC[-20] -> 1728 | AC16: =13824/RC[-20] -> 1728 | AD16: =13824/RC[-20] -> 1152 | AE16: =13824/RC[-20] -> 2304 | AF16: =RC[-6] -> 2304 | AG16: =RC[-6] -> 1152 | AH16: =RC[-6] -> 1728 | AI16: =RC[-6] -> 1728 | AJ16: =RC[-6] -> 1152 | AK16: =RC[-5] -> 2304 | AL16: =RC[-5] -> 1152 | AM16: =RC[-5] -> 1728 | AN16: =RC[-5] -> 1728 | AO16: =RC[-5] -> 1152 | AP16: =RC[-5] -> 2304 | AQ16: =RC[-5] -> 1152 | AR16: =RC[-5] -> 1728 | AS16: =RC[-5] -> 1728 | AT16: =RC[-5] -> 1152 | AU16: =RC[-5] -> 2304 | AV16: =RC[-5] -> 1152 | AW16: =RC[-5] -> 1728 | AX16: =RC[-5] -> 1728 | AY16: =RC[-5] -> 1152 | AZ16: =RC[-5] -> 2304 | BA16: =RC[-5] -> 1152 | BB16: =RC[-5] -> 1728 | BC16: =RC[-5] -> 1728 | BD16: =RC[-5] -> 1152 | BE16: =RC[-5] -> 2304 | BF16: =RC[-5] -> 1152 | BG16: =RC[-5] -> 1728 | BH16: =RC[-5] -> 1728 | BI16: =RC[-5] -> 1152 | BJ16: =RC[-5] -> 2304 | BK16: =RC[-5] -> 1152 | BL16: =RC[-5] -> 1728 | BM16: =RC[-5] -> 1728 | BN16: =RC[-5] -> 1152 | BO16: =RC[-5] -> 2304 | BP16: =RC[-5] -> 1152 | BQ16: =RC[-5] -> 1728 | BR16: =RC[-5] -> 1728 | BS16: =RC[-5] -> 1152
A17: 14 | B17: D | C17: K | D17: 猴子 | E17: 1013 | F17: =x!R[-3]C[-1] -> 6 | G17: =x!R[-3]C[-1] -> 12 | H17: =x!R[-3]C[-1] -> 8 | I17: =x!R[-3]C[-1] -> 8 | J17: =x!R[-3]C[-1] -> 12 | K17: =x!R[-3]C[-1] -> 6 | L17: =RC[14]/SUM(C[14]) -> 0.0680368532955351 | M17: =RC[14]/SUM(C[14]) -> 0.0299438552713662 | N17: =RC[14]/SUM(C[14]) -> 0.0477770404777704 | O17: =RC[14]/SUM(C[14]) -> 0.0528246515040352 | P17: =RC[14]/SUM(C[14]) -> 0.0299438552713662 | Q17: =RC[14]/SUM(C[14]) -> 0.0637027206370272 | R17: =RC[-12]*RC[-6] -> 0.40822111977321 | S17: =RC[-12]*RC[-6] -> 0.359326263256394 | T17: =RC[-12]*RC[-6] -> 0.382216323822163 | U17: =RC[-12]*RC[-6] -> 0.422597212032282 | V17: =RC[-12]*RC[-6] -> 0.359326263256394 | W17: =RC[-12]*RC[-6] -> 0.382216323822163 | X17: =R[-1]C -> 0.13607370659107 | Y17: =RC[1]/SUM(C[1]) -> 0.0680368532955351 | Z17: =13824/RC[-20] -> 2304 | AA17: =13824/RC[-20] -> 1152 | AB17: =13824/RC[-20] -> 1728 | AC17: =13824/RC[-20] -> 1728 | AD17: =13824/RC[-20] -> 1152 | AE17: =13824/RC[-20] -> 2304 | AF17: =RC[-6] -> 2304 | AG17: =RC[-6] -> 1152 | AH17: =RC[-6] -> 1728 | AI17: =RC[-6] -> 1728 | AJ17: =RC[-6] -> 1152 | AK17: =RC[-5] -> 2304 | AL17: =RC[-5] -> 1152 | AM17: =RC[-5] -> 1728 | AN17: =RC[-5] -> 1728 | AO17: =RC[-5] -> 1152 | AP17: =RC[-5] -> 2304 | AQ17: =RC[-5] -> 1152 | AR17: =RC[-5] -> 1728 | AS17: =RC[-5] -> 1728 | AT17: =RC[-5] -> 1152 | AU17: =RC[-5] -> 2304 | AV17: =RC[-5] -> 1152 | AW17: =RC[-5] -> 1728 | AX17: =RC[-5] -> 1728 | AY17: =RC[-5] -> 1152 | AZ17: =RC[-5] -> 2304 | BA17: =RC[-5] -> 1152 | BB17: =RC[-5] -> 1728 | BC17: =RC[-5] -> 1728 | BD17: =RC[-5] -> 1152 | BE17: =RC[-5] -> 2304 | BF17: =RC[-5] -> 1152 | BG17: =RC[-5] -> 1728 | BH17: =RC[-5] -> 1728 | BI17: =RC[-5] -> 1152 | BJ17: =RC[-5] -> 2304 | BK17: =RC[-5] -> 1152 | BL17: =RC[-5] -> 1728 | BM17: =RC[-5] -> 1728 | BN17: =RC[-5] -> 1152 | BO17: =RC[-5] -> 2304 | BP17: =RC[-5] -> 1152 | BQ17: =RC[-5] -> 1728 | BR17: =RC[-5] -> 1728 | BS17: =RC[-5] -> 1152
A18: 15 | B18: . | C18: B | D18: 银鲨鱼 | E18: =R[-14]C -> 200 | F18: =R[-14]C -> 24 | G18: =R[-14]C -> 24 | H18: =R[-14]C -> 24 | I18: =R[-14]C -> 24 | J18: =R[-14]C -> 24 | K18: =R[-14]C -> 24 | L18: =RC[14]/SUM(C[14]) -> 0.00224427120245689 | M18: =RC[14]/SUM(C[14]) -> 0.00197546267415263 | N18: =RC[14]/SUM(C[14]) -> 0.00210130502101305 | O18: =RC[14]/SUM(C[14]) -> 0.00232330643189044 | P18: =RC[14]/SUM(C[14]) -> 0.00197546267415263 | Q18: =RC[14]/SUM(C[14]) -> 0.00210130502101305 | R18: =RC[-12]*RC[-6] -> 0.0538625088589653 | S18: =RC[-12]*RC[-6] -> 0.0474111041796631 | T18: =RC[-12]*RC[-6] -> 0.0504313205043132 | U18: =RC[-12]*RC[-6] -> 0.0557593543653705 | V18: =RC[-12]*RC[-6] -> 0.0474111041796631 | W18: =RC[-12]*RC[-6] -> 0.0504313205043132 | X18: =R[-6]C -> 0.00897708480982755 | Y18: =RC[1]/SUM(C[1]) -> 0.00224427120245689 | Z18: =R[-14]C -> 76 | AA18: =R[-14]C -> 76 | AB18: =R[-14]C -> 76 | AC18: =R[-14]C -> 76 | AD18: =R[-14]C -> 76 | AE18: =R[-14]C -> 76 | AF18: =RC[-6] -> 76 | AG18: =RC[-6] -> 76 | AH18: =RC[-6] -> 76 | AI18: =RC[-6] -> 76 | AJ18: =RC[-6] -> 76 | AK18: =RC[-5] -> 76 | AL18: =RC[-5] -> 76 | AM18: =RC[-5] -> 76 | AN18: =RC[-5] -> 76 | AO18: =RC[-5] -> 76 | AP18: =RC[-5] -> 76 | AQ18: =RC[-5] -> 76 | AR18: =RC[-5] -> 76 | AS18: =RC[-5] -> 76 | AT18: =RC[-5] -> 76 | AU18: =RC[-5] -> 76 | AV18: =RC[-5] -> 76 | AW18: =RC[-5] -> 76 | AX18: =RC[-5] -> 76 | AY18: =RC[-5] -> 76 | AZ18: =RC[-5] -> 76 | BA18: =RC[-5] -> 76 | BB18: =RC[-5] -> 76 | BC18: =RC[-5] -> 76 | BD18: =RC[-5] -> 76 | BE18: =RC[-5] -> 76 | BF18: =RC[-5] -> 76 | BG18: =RC[-5] -> 76 | BH18: =RC[-5] -> 76 | BI18: =RC[-5] -> 76 | BJ18: =RC[-5] -> 76 | BK18: =RC[-5] -> 76 | BL18: =RC[-5] -> 76 | BM18: =RC[-5] -> 76 | BN18: =RC[-5] -> 76 | BO18: =RC[-5] -> 76 | BP18: =RC[-5] -> 76 | BQ18: =RC[-5] -> 76 | BR18: =RC[-5] -> 76 | BS18: =RC[-5] -> 76
A19: 16 | B19: D | C19: L | D19: 兔子 | E19: 1015 | F19: =x!R[-4]C[-1] -> 6 | G19: =x!R[-4]C[-1] -> 3 | H19: =x!R[-4]C[-1] -> 4 | I19: =x!R[-4]C[-1] -> 6 | J19: =x!R[-4]C[-1] -> 3 | K19: =x!R[-4]C[-1] -> 4 | L19: =RC[14]/SUM(C[14]) -> 0.0680368532955351 | M19: =RC[14]/SUM(C[14]) -> 0.119775421085465 | N19: =RC[14]/SUM(C[14]) -> 0.0955540809555408 | O19: =RC[14]/SUM(C[14]) -> 0.070432868672047 | P19: =RC[14]/SUM(C[14]) -> 0.119775421085465 | Q19: =RC[14]/SUM(C[14]) -> 0.0955540809555408 | R19: =RC[-12]*RC[-6] -> 0.40822111977321 | S19: =RC[-12]*RC[-6] -> 0.359326263256394 | T19: =RC[-12]*RC[-6] -> 0.382216323822163 | U19: =RC[-12]*RC[-6] -> 0.422597212032282 | V19: =RC[-12]*RC[-6] -> 0.359326263256394 | W19: =RC[-12]*RC[-6] -> 0.382216323822163 | X19: =SUM(RC[1]:R[2]C[1]) -> 0.204110559886605 | Y19: =RC[1]/SUM(C[1]) -> 0.0680368532955351 | Z19: =13824/RC[-20] -> 2304 | AA19: =13824/RC[-20] -> 4608 | AB19: =13824/RC[-20] -> 3456 | AC19: =13824/RC[-20] -> 2304 | AD19: =13824/RC[-20] -> 4608 | AE19: =13824/RC[-20] -> 3456 | AF19: =RC[-6] -> 2304 | AG19: =RC[-6] -> 4608 | AH19: =RC[-6] -> 3456 | AI19: =RC[-6] -> 2304 | AJ19: =RC[-6] -> 4608 | AK19: =RC[-5] -> 2304 | AL19: =RC[-5] -> 4608 | AM19: =RC[-5] -> 3456 | AN19: =RC[-5] -> 2304 | AO19: =RC[-5] -> 4608 | AP19: =RC[-5] -> 2304 | AQ19: =RC[-5] -> 4608 | AR19: =RC[-5] -> 3456 | AS19: =RC[-5] -> 2304 | AT19: =RC[-5] -> 4608 | AU19: =RC[-5] -> 2304 | AV19: =RC[-5] -> 4608 | AW19: =RC[-5] -> 3456 | AX19: =RC[-5] -> 2304 | AY19: =RC[-5] -> 4608 | AZ19: =RC[-5] -> 2304 | BA19: =RC[-5] -> 4608 | BB19: =RC[-5] -> 3456 | BC19: =RC[-5] -> 2304 | BD19: =RC[-5] -> 4608 | BE19: =RC[-5] -> 2304 | BF19: =RC[-5] -> 4608 | BG19: =RC[-5] -> 3456 | BH19: =RC[-5] -> 2304 | BI19: =RC[-5] -> 4608 | BJ19: =RC[-5] -> 2304 | BK19: =RC[-5] -> 4608 | BL19: =RC[-5] -> 3456 | BM19: =RC[-5] -> 2304 | BN19: =RC[-5] -> 4608 | BO19: =RC[-5] -> 2304 | BP19: =RC[-5] -> 4608 | BQ19: =RC[-5] -> 3456 | BR19: =RC[-5] -> 2304 | BS19: =RC[-5] -> 4608
A20: 17 | B20: D | C20: L | D20: 兔子 | E20: 1016 | F20: =R[-1]C -> 6 | G20: =R[-1]C -> 3 | H20: =R[-1]C -> 4 | I20: =R[-1]C -> 6 | J20: =R[-1]C -> 3 | K20: =R[-1]C -> 4 | L20: =RC[14]/SUM(C[14]) -> 0.0680368532955351 | M20: =RC[14]/SUM(C[14]) -> 0.119775421085465 | N20: =RC[14]/SUM(C[14]) -> 0.0955540809555408 | O20: =RC[14]/SUM(C[14]) -> 0.070432868672047 | P20: =RC[14]/SUM(C[14]) -> 0.119775421085465 | Q20: =RC[14]/SUM(C[14]) -> 0.0955540809555408 | R20: =RC[-12]*RC[-6] -> 0.40822111977321 | S20: =RC[-12]*RC[-6] -> 0.359326263256394 | T20: =RC[-12]*RC[-6] -> 0.382216323822163 | U20: =RC[-12]*RC[-6] -> 0.422597212032282 | V20: =RC[-12]*RC[-6] -> 0.359326263256394 | W20: =RC[-12]*RC[-6] -> 0.382216323822163 | X20: =R[-1]C -> 0.204110559886605 | Y20: =RC[1]/SUM(C[1]) -> 0.0680368532955351 | Z20: =13824/RC[-20] -> 2304 | AA20: =13824/RC[-20] -> 4608 | AB20: =13824/RC[-20] -> 3456 | AC20: =13824/RC[-20] -> 2304 | AD20: =13824/RC[-20] -> 4608 | AE20: =13824/RC[-20] -> 3456 | AF20: =RC[-6] -> 2304 | AG20: =RC[-6] -> 4608 | AH20: =RC[-6] -> 3456 | AI20: =RC[-6] -> 2304 | AJ20: =RC[-6] -> 4608 | AK20: =RC[-5] -> 2304 | AL20: =RC[-5] -> 4608 | AM20: =RC[-5] -> 3456 | AN20: =RC[-5] -> 2304 | AO20: =RC[-5] -> 4608 | AP20: =RC[-5] -> 2304 | AQ20: =RC[-5] -> 4608 | AR20: =RC[-5] -> 3456 | AS20: =RC[-5] -> 2304 | AT20: =RC[-5] -> 4608 | AU20: =RC[-5] -> 2304 | AV20: =RC[-5] -> 4608 | AW20: =RC[-5] -> 3456 | AX20: =RC[-5] -> 2304 | AY20: =RC[-5] -> 4608 | AZ20: =RC[-5] -> 2304 | BA20: =RC[-5] -> 4608 | BB20: =RC[-5] -> 3456 | BC20: =RC[-5] -> 2304 | BD20: =RC[-5] -> 4608 | BE20: =RC[-5] -> 2304 | BF20: =RC[-5] -> 4608 | BG20: =RC[-5] -> 3456 | BH20: =RC[-5] -> 2304 | BI20: =RC[-5] -> 4608 | BJ20: =RC[-5] -> 2304 | BK20: =RC[-5] -> 4608 | BL20: =RC[-5] -> 3456 | BM20: =RC[-5] -> 2304 | BN20: =RC[-5] -> 4608 | BO20: =RC[-5] -> 2304 | BP20: =RC[-5] -> 4608 | BQ20: =RC[-5] -> 3456 | BR20: =RC[-5] -> 2304 | BS20: =RC[-5] -> 4608
A21: 18 | B21: D | C21: L | D21: 兔子 | E21: 1017 | F21: =R[-2]C -> 6 | G21: =R[-2]C -> 3 | H21: =R[-2]C -> 4 | I21: =R[-2]C -> 6 | J21: =R[-2]C -> 3 | K21: =R[-2]C -> 4 | L21: =RC[14]/SUM(C[14]) -> 0.0680368532955351 | M21: =RC[14]/SUM(C[14]) -> 0.119775421085465 | N21: =RC[14]/SUM(C[14]) -> 0.0955540809555408 | O21: =RC[14]/SUM(C[14]) -> 0.070432868672047 | P21: =RC[14]/SUM(C[14]) -> 0.119775421085465 | Q21: =RC[14]/SUM(C[14]) -> 0.0955540809555408 | R21: =RC[-12]*RC[-6] -> 0.40822111977321 | S21: =RC[-12]*RC[-6] -> 0.359326263256394 | T21: =RC[-12]*RC[-6] -> 0.382216323822163 | U21: =RC[-12]*RC[-6] -> 0.422597212032282 | V21: =RC[-12]*RC[-6] -> 0.359326263256394 | W21: =RC[-12]*RC[-6] -> 0.382216323822163 | X21: =R[-2]C -> 0.204110559886605 | Y21: =RC[1]/SUM(C[1]) -> 0.0680368532955351 | Z21: =13824/RC[-20] -> 2304 | AA21: =13824/RC[-20] -> 4608 | AB21: =13824/RC[-20] -> 3456 | AC21: =13824/RC[-20] -> 2304 | AD21: =13824/RC[-20] -> 4608 | AE21: =13824/RC[-20] -> 3456 | AF21: =RC[-6] -> 2304 | AG21: =RC[-6] -> 4608 | AH21: =RC[-6] -> 3456 | AI21: =RC[-6] -> 2304 | AJ21: =RC[-6] -> 4608 | AK21: =RC[-5] -> 2304 | AL21: =RC[-5] -> 4608 | AM21: =RC[-5] -> 3456 | AN21: =RC[-5] -> 2304 | AO21: =RC[-5] -> 4608 | AP21: =RC[-5] -> 2304 | AQ21: =RC[-5] -> 4608 | AR21: =RC[-5] -> 3456 | AS21: =RC[-5] -> 2304 | AT21: =RC[-5] -> 4608 | AU21: =RC[-5] -> 2304 | AV21: =RC[-5] -> 4608 | AW21: =RC[-5] -> 3456 | AX21: =RC[-5] -> 2304 | AY21: =RC[-5] -> 4608 | AZ21: =RC[-5] -> 2304 | BA21: =RC[-5] -> 4608 | BB21: =RC[-5] -> 3456 | BC21: =RC[-5] -> 2304 | BD21: =RC[-5] -> 4608 | BE21: =RC[-5] -> 2304 | BF21: =RC[-5] -> 4608 | BG21: =RC[-5] -> 3456 | BH21: =RC[-5] -> 2304 | BI21: =RC[-5] -> 4608 | BJ21: =RC[-5] -> 2304 | BK21: =RC[-5] -> 4608 | BL21: =RC[-5] -> 3456 | BM21: =RC[-5] -> 2304 | BN21: =RC[-5] -> 4608 | BO21: =RC[-5] -> 2304 | BP21: =RC[-5] -> 4608 | BQ21: =RC[-5] -> 3456 | BR21: =RC[-5] -> 2304 | BS21: =RC[-5] -> 4608
A22: 19 | B22: . | C22: C | D22: 金鲨鱼 | E22: =R[-14]C -> 100 | F22: =R[-14]C -> 48 | G22: =R[-14]C -> 48 | H22: =R[-14]C -> 48 | I22: =R[-14]C -> 48 | J22: =R[-14]C -> 48 | K22: =R[-14]C -> 48 | L22: =RC[14]/SUM(C[14]) -> 0.00112213560122844 | M22: =RC[14]/SUM(C[14]) -> 0.000987731337076315 | N22: =RC[14]/SUM(C[14]) -> 0.00105065251050653 | O22: =RC[14]/SUM(C[14]) -> 0.00116165321594522 | P22: =RC[14]/SUM(C[14]) -> 0.000987731337076315 | Q22: =RC[14]/SUM(C[14]) -> 0.00105065251050653 | R22: =RC[-12]*RC[-6] -> 0.0538625088589653 | S22: =RC[-12]*RC[-6] -> 0.0474111041796631 | T22: =RC[-12]*RC[-6] -> 0.0504313205043132 | U22: =RC[-12]*RC[-6] -> 0.0557593543653705 | V22: =RC[-12]*RC[-6] -> 0.0474111041796631 | W22: =RC[-12]*RC[-6] -> 0.0504313205043132 | X22: =R[-7]C -> 0.00448854240491377 | Y22: =RC[1]/SUM(C[1]) -> 0.00112213560122844 | Z22: =R[-14]C -> 38 | AA22: =R[-14]C -> 38 | AB22: =R[-14]C -> 38 | AC22: =R[-14]C -> 38 | AD22: =R[-14]C -> 38 | AE22: =R[-14]C -> 38 | AF22: =RC[-6] -> 38 | AG22: =RC[-6] -> 38 | AH22: =RC[-6] -> 38 | AI22: =RC[-6] -> 38 | AJ22: =RC[-6] -> 38 | AK22: =RC[-5] -> 38 | AL22: =RC[-5] -> 38 | AM22: =RC[-5] -> 38 | AN22: =RC[-5] -> 38 | AO22: =RC[-5] -> 38 | AP22: =RC[-5] -> 38 | AQ22: =RC[-5] -> 38 | AR22: =RC[-5] -> 38 | AS22: =RC[-5] -> 38 | AT22: =RC[-5] -> 38 | AU22: =RC[-5] -> 38 | AV22: =RC[-5] -> 38 | AW22: =RC[-5] -> 38 | AX22: =RC[-5] -> 38 | AY22: =RC[-5] -> 38 | AZ22: =RC[-5] -> 38 | BA22: =RC[-5] -> 38 | BB22: =RC[-5] -> 38 | BC22: =RC[-5] -> 38 | BD22: =RC[-5] -> 38 | BE22: =RC[-5] -> 38 | BF22: =RC[-5] -> 38 | BG22: =RC[-5] -> 38 | BH22: =RC[-5] -> 38 | BI22: =RC[-5] -> 38 | BJ22: =RC[-5] -> 38 | BK22: =RC[-5] -> 38 | BL22: =RC[-5] -> 38 | BM22: =RC[-5] -> 38 | BN22: =RC[-5] -> 38 | BO22: =RC[-5] -> 38 | BP22: =RC[-5] -> 38 | BQ22: =RC[-5] -> 38 | BR22: =RC[-5] -> 38 | BS22: =RC[-5] -> 38
A23: 20 | B23: A | C23: E | D23: 燕子 | E23: 1019 | F23: =x!R[-15]C[-1] -> 6 | G23: =x!R[-15]C[-1] -> 3 | H23: =x!R[-15]C[-1] -> 4 | I23: =x!R[-15]C[-1] -> 6 | J23: =x!R[-15]C[-1] -> 3 | K23: =x!R[-15]C[-1] -> 4 | L23: =RC[14]/SUM(C[14]) -> 0.0680368532955351 | M23: =RC[14]/SUM(C[14]) -> 0.119775421085465 | N23: =RC[14]/SUM(C[14]) -> 0.0955540809555408 | O23: =RC[14]/SUM(C[14]) -> 0.070432868672047 | P23: =RC[14]/SUM(C[14]) -> 0.119775421085465 | Q23: =RC[14]/SUM(C[14]) -> 0.0955540809555408 | R23: =RC[-12]*RC[-6] -> 0.40822111977321 | S23: =RC[-12]*RC[-6] -> 0.359326263256394 | T23: =RC[-12]*RC[-6] -> 0.382216323822163 | U23: =RC[-12]*RC[-6] -> 0.422597212032282 | V23: =RC[-12]*RC[-6] -> 0.359326263256394 | W23: =RC[-12]*RC[-6] -> 0.382216323822163 | X23: =SUM(RC[1]:R[2]C[1]) -> 0.204110559886605 | Y23: =RC[1]/SUM(C[1]) -> 0.0680368532955351 | Z23: =13824/RC[-20] -> 2304 | AA23: =13824/RC[-20] -> 4608 | AB23: =13824/RC[-20] -> 3456 | AC23: =13824/RC[-20] -> 2304 | AD23: =13824/RC[-20] -> 4608 | AE23: =13824/RC[-20] -> 3456 | AF23: =RC[-6] -> 2304 | AG23: =RC[-6] -> 4608 | AH23: =RC[-6] -> 3456 | AI23: =RC[-6] -> 2304 | AJ23: =RC[-6] -> 4608 | AK23: =RC[-5] -> 2304 | AL23: =RC[-5] -> 4608 | AM23: =RC[-5] -> 3456 | AN23: =RC[-5] -> 2304 | AO23: =RC[-5] -> 4608 | AP23: =RC[-5] -> 2304 | AQ23: =RC[-5] -> 4608 | AR23: =RC[-5] -> 3456 | AS23: =RC[-5] -> 2304 | AT23: =RC[-5] -> 4608 | AU23: =RC[-5] -> 2304 | AV23: =RC[-5] -> 4608 | AW23: =RC[-5] -> 3456 | AX23: =RC[-5] -> 2304 | AY23: =RC[-5] -> 4608 | AZ23: =RC[-5] -> 2304 | BA23: =RC[-5] -> 4608 | BB23: =RC[-5] -> 3456 | BC23: =RC[-5] -> 2304 | BD23: =RC[-5] -> 4608 | BE23: =RC[-5] -> 2304 | BF23: =RC[-5] -> 4608 | BG23: =RC[-5] -> 3456 | BH23: =RC[-5] -> 2304 | BI23: =RC[-5] -> 4608 | BJ23: =RC[-5] -> 2304 | BK23: =RC[-5] -> 4608 | BL23: =RC[-5] -> 3456 | BM23: =RC[-5] -> 2304 | BN23: =RC[-5] -> 4608 | BO23: =RC[-5] -> 2304 | BP23: =RC[-5] -> 4608 | BQ23: =RC[-5] -> 3456 | BR23: =RC[-5] -> 2304 | BS23: =RC[-5] -> 4608
A24: 21 | B24: A | C24: E | D24: 燕子 | E24: 1020 | F24: =R[-1]C -> 6 | G24: =R[-1]C -> 3 | H24: =R[-1]C -> 4 | I24: =R[-1]C -> 6 | J24: =R[-1]C -> 3 | K24: =R[-1]C -> 4 | L24: =RC[14]/SUM(C[14]) -> 0.0680368532955351 | M24: =RC[14]/SUM(C[14]) -> 0.119775421085465 | N24: =RC[14]/SUM(C[14]) -> 0.0955540809555408 | O24: =RC[14]/SUM(C[14]) -> 0.070432868672047 | P24: =RC[14]/SUM(C[14]) -> 0.119775421085465 | Q24: =RC[14]/SUM(C[14]) -> 0.0955540809555408 | R24: =RC[-12]*RC[-6] -> 0.40822111977321 | S24: =RC[-12]*RC[-6] -> 0.359326263256394 | T24: =RC[-12]*RC[-6] -> 0.382216323822163 | U24: =RC[-12]*RC[-6] -> 0.422597212032282 | V24: =RC[-12]*RC[-6] -> 0.359326263256394 | W24: =RC[-12]*RC[-6] -> 0.382216323822163 | X24: =R[-1]C -> 0.204110559886605 | Y24: =RC[1]/SUM(C[1]) -> 0.0680368532955351 | Z24: =13824/RC[-20] -> 2304 | AA24: =13824/RC[-20] -> 4608 | AB24: =13824/RC[-20] -> 3456 | AC24: =13824/RC[-20] -> 2304 | AD24: =13824/RC[-20] -> 4608 | AE24: =13824/RC[-20] -> 3456 | AF24: =RC[-6] -> 2304 | AG24: =RC[-6] -> 4608 | AH24: =RC[-6] -> 3456 | AI24: =RC[-6] -> 2304 | AJ24: =RC[-6] -> 4608 | AK24: =RC[-5] -> 2304 | AL24: =RC[-5] -> 4608 | AM24: =RC[-5] -> 3456 | AN24: =RC[-5] -> 2304 | AO24: =RC[-5] -> 4608 | AP24: =RC[-5] -> 2304 | AQ24: =RC[-5] -> 4608 | AR24: =RC[-5] -> 3456 | AS24: =RC[-5] -> 2304 | AT24: =RC[-5] -> 4608 | AU24: =RC[-5] -> 2304 | AV24: =RC[-5] -> 4608 | AW24: =RC[-5] -> 3456 | AX24: =RC[-5] -> 2304 | AY24: =RC[-5] -> 4608 | AZ24: =RC[-5] -> 2304 | BA24: =RC[-5] -> 4608 | BB24: =RC[-5] -> 3456 | BC24: =RC[-5] -> 2304 | BD24: =RC[-5] -> 4608 | BE24: =RC[-5] -> 2304 | BF24: =RC[-5] -> 4608 | BG24: =RC[-5] -> 3456 | BH24: =RC[-5] -> 2304 | BI24: =RC[-5] -> 4608 | BJ24: =RC[-5] -> 2304 | BK24: =RC[-5] -> 4608 | BL24: =RC[-5] -> 3456 | BM24: =RC[-5] -> 2304 | BN24: =RC[-5] -> 4608 | BO24: =RC[-5] -> 2304 | BP24: =RC[-5] -> 4608 | BQ24: =RC[-5] -> 3456 | BR24: =RC[-5] -> 2304 | BS24: =RC[-5] -> 4608
A25: 22 | B25: A | C25: E | D25: 燕子 | E25: 1021 | F25: =R[-2]C -> 6 | G25: =R[-2]C -> 3 | H25: =R[-2]C -> 4 | I25: =R[-2]C -> 6 | J25: =R[-2]C -> 3 | K25: =R[-2]C -> 4 | L25: =RC[14]/SUM(C[14]) -> 0.0680368532955351 | M25: =RC[14]/SUM(C[14]) -> 0.119775421085465 | N25: =RC[14]/SUM(C[14]) -> 0.0955540809555408 | O25: =RC[14]/SUM(C[14]) -> 0.070432868672047 | P25: =RC[14]/SUM(C[14]) -> 0.119775421085465 | Q25: =RC[14]/SUM(C[14]) -> 0.0955540809555408 | R25: =RC[-12]*RC[-6] -> 0.40822111977321 | S25: =RC[-12]*RC[-6] -> 0.359326263256394 | T25: =RC[-12]*RC[-6] -> 0.382216323822163 | U25: =RC[-12]*RC[-6] -> 0.422597212032282 | V25: =RC[-12]*RC[-6] -> 0.359326263256394 | W25: =RC[-12]*RC[-6] -> 0.382216323822163 | X25: =R[-2]C -> 0.204110559886605 | Y25: =RC[1]/SUM(C[1]) -> 0.0680368532955351 | Z25: =13824/RC[-20] -> 2304 | AA25: =13824/RC[-20] -> 4608 | AB25: =13824/RC[-20] -> 3456 | AC25: =13824/RC[-20] -> 2304 | AD25: =13824/RC[-20] -> 4608 | AE25: =13824/RC[-20] -> 3456 | AF25: =RC[-6] -> 2304 | AG25: =RC[-6] -> 4608 | AH25: =RC[-6] -> 3456 | AI25: =RC[-6] -> 2304 | AJ25: =RC[-6] -> 4608 | AK25: =RC[-5] -> 2304 | AL25: =RC[-5] -> 4608 | AM25: =RC[-5] -> 3456 | AN25: =RC[-5] -> 2304 | AO25: =RC[-5] -> 4608 | AP25: =RC[-5] -> 2304 | AQ25: =RC[-5] -> 4608 | AR25: =RC[-5] -> 3456 | AS25: =RC[-5] -> 2304 | AT25: =RC[-5] -> 4608 | AU25: =RC[-5] -> 2304 | AV25: =RC[-5] -> 4608 | AW25: =RC[-5] -> 3456 | AX25: =RC[-5] -> 2304 | AY25: =RC[-5] -> 4608 | AZ25: =RC[-5] -> 2304 | BA25: =RC[-5] -> 4608 | BB25: =RC[-5] -> 3456 | BC25: =RC[-5] -> 2304 | BD25: =RC[-5] -> 4608 | BE25: =RC[-5] -> 2304 | BF25: =RC[-5] -> 4608 | BG25: =RC[-5] -> 3456 | BH25: =RC[-5] -> 2304 | BI25: =RC[-5] -> 4608 | BJ25: =RC[-5] -> 2304 | BK25: =RC[-5] -> 4608 | BL25: =RC[-5] -> 3456 | BM25: =RC[-5] -> 2304 | BN25: =RC[-5] -> 4608 | BO25: =RC[-5] -> 2304 | BP25: =RC[-5] -> 4608 | BQ25: =RC[-5] -> 3456 | BR25: =RC[-5] -> 2304 | BS25: =RC[-5] -> 4608
A26: 23 | B26: . | C26: B | D26: 银鲨鱼 | E26: =R[-22]C -> 200 | F26: =R[-22]C -> 24 | G26: =R[-22]C -> 24 | H26: =R[-22]C -> 24 | I26: =R[-22]C -> 24 | J26: =R[-22]C -> 24 | K26: =R[-22]C -> 24 | L26: =RC[14]/SUM(C[14]) -> 0.00224427120245689 | M26: =RC[14]/SUM(C[14]) -> 0.00197546267415263 | N26: =RC[14]/SUM(C[14]) -> 0.00210130502101305 | O26: =RC[14]/SUM(C[14]) -> 0.00232330643189044 | P26: =RC[14]/SUM(C[14]) -> 0.00197546267415263 | Q26: =RC[14]/SUM(C[14]) -> 0.00210130502101305 | R26: =RC[-12]*RC[-6] -> 0.0538625088589653 | S26: =RC[-12]*RC[-6] -> 0.0474111041796631 | T26: =RC[-12]*RC[-6] -> 0.0504313205043132 | U26: =RC[-12]*RC[-6] -> 0.0557593543653705 | V26: =RC[-12]*RC[-6] -> 0.0474111041796631 | W26: =RC[-12]*RC[-6] -> 0.0504313205043132 | X26: =R[-22]C -> 0.00897708480982755 | Y26: =RC[1]/SUM(C[1]) -> 0.00224427120245689 | Z26: =R[-22]C -> 76 | AA26: =R[-22]C -> 76 | AB26: =R[-22]C -> 76 | AC26: =R[-22]C -> 76 | AD26: =R[-22]C -> 76 | AE26: =R[-22]C -> 76 | AF26: =RC[-6] -> 76 | AG26: =RC[-6] -> 76 | AH26: =RC[-6] -> 76 | AI26: =RC[-6] -> 76 | AJ26: =RC[-6] -> 76 | AK26: =RC[-5] -> 76 | AL26: =RC[-5] -> 76 | AM26: =RC[-5] -> 76 | AN26: =RC[-5] -> 76 | AO26: =RC[-5] -> 76 | AP26: =RC[-5] -> 76 | AQ26: =RC[-5] -> 76 | AR26: =RC[-5] -> 76 | AS26: =RC[-5] -> 76 | AT26: =RC[-5] -> 76 | AU26: =RC[-5] -> 76 | AV26: =RC[-5] -> 76 | AW26: =RC[-5] -> 76 | AX26: =RC[-5] -> 76 | AY26: =RC[-5] -> 76 | AZ26: =RC[-5] -> 76 | BA26: =RC[-5] -> 76 | BB26: =RC[-5] -> 76 | BC26: =RC[-5] -> 76 | BD26: =RC[-5] -> 76 | BE26: =RC[-5] -> 76 | BF26: =RC[-5] -> 76 | BG26: =RC[-5] -> 76 | BH26: =RC[-5] -> 76 | BI26: =RC[-5] -> 76 | BJ26: =RC[-5] -> 76 | BK26: =RC[-5] -> 76 | BL26: =RC[-5] -> 76 | BM26: =RC[-5] -> 76 | BN26: =RC[-5] -> 76 | BO26: =RC[-5] -> 76 | BP26: =RC[-5] -> 76 | BQ26: =RC[-5] -> 76 | BR26: =RC[-5] -> 76 | BS26: =RC[-5] -> 76
A27: 24 | B27: A | C27: F | D27: 鸽子 | E27: 1023 | F27: =x!R[-18]C[-1] -> 6 | G27: =x!R[-18]C[-1] -> 12 | H27: =x!R[-18]C[-1] -> 8 | I27: =x!R[-18]C[-1] -> 8 | J27: =x!R[-18]C[-1] -> 12 | K27: =x!R[-18]C[-1] -> 6 | L27: =RC[14]/SUM(C[14]) -> 0.0680368532955351 | M27: =RC[14]/SUM(C[14]) -> 0.0299438552713662 | N27: =RC[14]/SUM(C[14]) -> 0.0477770404777704 | O27: =RC[14]/SUM(C[14]) -> 0.0528246515040352 | P27: =RC[14]/SUM(C[14]) -> 0.0299438552713662 | Q27: =RC[14]/SUM(C[14]) -> 0.0637027206370272 | R27: =RC[-12]*RC[-6] -> 0.40822111977321 | S27: =RC[-12]*RC[-6] -> 0.359326263256394 | T27: =RC[-12]*RC[-6] -> 0.382216323822163 | U27: =RC[-12]*RC[-6] -> 0.422597212032282 | V27: =RC[-12]*RC[-6] -> 0.359326263256394 | W27: =RC[-12]*RC[-6] -> 0.382216323822163 | X27: =SUM(RC[1]:R[1]C[1]) -> 0.13607370659107 | Y27: =RC[1]/SUM(C[1]) -> 0.0680368532955351 | Z27: =13824/RC[-20] -> 2304 | AA27: =13824/RC[-20] -> 1152 | AB27: =13824/RC[-20] -> 1728 | AC27: =13824/RC[-20] -> 1728 | AD27: =13824/RC[-20] -> 1152 | AE27: =13824/RC[-20] -> 2304 | AF27: =RC[-6] -> 2304 | AG27: =RC[-6] -> 1152 | AH27: =RC[-6] -> 1728 | AI27: =RC[-6] -> 1728 | AJ27: =RC[-6] -> 1152 | AK27: =RC[-5] -> 2304 | AL27: =RC[-5] -> 1152 | AM27: =RC[-5] -> 1728 | AN27: =RC[-5] -> 1728 | AO27: =RC[-5] -> 1152 | AP27: =RC[-5] -> 2304 | AQ27: =RC[-5] -> 1152 | AR27: =RC[-5] -> 1728 | AS27: =RC[-5] -> 1728 | AT27: =RC[-5] -> 1152 | AU27: =RC[-5] -> 2304 | AV27: =RC[-5] -> 1152 | AW27: =RC[-5] -> 1728 | AX27: =RC[-5] -> 1728 | AY27: =RC[-5] -> 1152 | AZ27: =RC[-5] -> 2304 | BA27: =RC[-5] -> 1152 | BB27: =RC[-5] -> 1728 | BC27: =RC[-5] -> 1728 | BD27: =RC[-5] -> 1152 | BE27: =RC[-5] -> 2304 | BF27: =RC[-5] -> 1152 | BG27: =RC[-5] -> 1728 | BH27: =RC[-5] -> 1728 | BI27: =RC[-5] -> 1152 | BJ27: =RC[-5] -> 2304 | BK27: =RC[-5] -> 1152 | BL27: =RC[-5] -> 1728 | BM27: =RC[-5] -> 1728 | BN27: =RC[-5] -> 1152 | BO27: =RC[-5] -> 2304 | BP27: =RC[-5] -> 1152 | BQ27: =RC[-5] -> 1728 | BR27: =RC[-5] -> 1728 | BS27: =RC[-5] -> 1152
A28: 25 | B28: A | C28: F | D28: 鸽子 | E28: 1024 | F28: =R[-1]C -> 6 | G28: =R[-1]C -> 12 | H28: =R[-1]C -> 8 | I28: =R[-1]C -> 8 | J28: =R[-1]C -> 12 | K28: =R[-1]C -> 6 | L28: =RC[14]/SUM(C[14]) -> 0.0680368532955351 | M28: =RC[14]/SUM(C[14]) -> 0.0299438552713662 | N28: =RC[14]/SUM(C[14]) -> 0.0477770404777704 | O28: =RC[14]/SUM(C[14]) -> 0.0528246515040352 | P28: =RC[14]/SUM(C[14]) -> 0.0299438552713662 | Q28: =RC[14]/SUM(C[14]) -> 0.0637027206370272 | R28: =RC[-12]*RC[-6] -> 0.40822111977321 | S28: =RC[-12]*RC[-6] -> 0.359326263256394 | T28: =RC[-12]*RC[-6] -> 0.382216323822163 | U28: =RC[-12]*RC[-6] -> 0.422597212032282 | V28: =RC[-12]*RC[-6] -> 0.359326263256394 | W28: =RC[-12]*RC[-6] -> 0.382216323822163 | X28: =R[-1]C -> 0.13607370659107 | Y28: =RC[1]/SUM(C[1]) -> 0.0680368532955351 | Z28: =13824/RC[-20] -> 2304 | AA28: =13824/RC[-20] -> 1152 | AB28: =13824/RC[-20] -> 1728 | AC28: =13824/RC[-20] -> 1728 | AD28: =13824/RC[-20] -> 1152 | AE28: =13824/RC[-20] -> 2304 | AF28: =RC[-6] -> 2304 | AG28: =RC[-6] -> 1152 | AH28: =RC[-6] -> 1728 | AI28: =RC[-6] -> 1728 | AJ28: =RC[-6] -> 1152 | AK28: =RC[-5] -> 2304 | AL28: =RC[-5] -> 1152 | AM28: =RC[-5] -> 1728 | AN28: =RC[-5] -> 1728 | AO28: =RC[-5] -> 1152 | AP28: =RC[-5] -> 2304 | AQ28: =RC[-5] -> 1152 | AR28: =RC[-5] -> 1728 | AS28: =RC[-5] -> 1728 | AT28: =RC[-5] -> 1152 | AU28: =RC[-5] -> 2304 | AV28: =RC[-5] -> 1152 | AW28: =RC[-5] -> 1728 | AX28: =RC[-5] -> 1728 | AY28: =RC[-5] -> 1152 | AZ28: =RC[-5] -> 2304 | BA28: =RC[-5] -> 1152 | BB28: =RC[-5] -> 1728 | BC28: =RC[-5] -> 1728 | BD28: =RC[-5] -> 1152 | BE28: =RC[-5] -> 2304 | BF28: =RC[-5] -> 1152 | BG28: =RC[-5] -> 1728 | BH28: =RC[-5] -> 1728 | BI28: =RC[-5] -> 1152 | BJ28: =RC[-5] -> 2304 | BK28: =RC[-5] -> 1152 | BL28: =RC[-5] -> 1728 | BM28: =RC[-5] -> 1728 | BN28: =RC[-5] -> 1152 | BO28: =RC[-5] -> 2304 | BP28: =RC[-5] -> 1152 | BQ28: =RC[-5] -> 1728 | BR28: =RC[-5] -> 1728 | BS28: =RC[-5] -> 1152
A29: 26 | B29: . | C29: C | D29: 金鲨鱼 | E29: =R[-21]C -> 100 | F29: =R[-21]C -> 48 | G29: =R[-21]C -> 48 | H29: =R[-21]C -> 48 | I29: =R[-21]C -> 48 | J29: =R[-21]C -> 48 | K29: =R[-21]C -> 48 | L29: =RC[14]/SUM(C[14]) -> 0.00112213560122844 | M29: =RC[14]/SUM(C[14]) -> 0.000987731337076315 | N29: =RC[14]/SUM(C[14]) -> 0.00105065251050653 | O29: =RC[14]/SUM(C[14]) -> 0.00116165321594522 | P29: =RC[14]/SUM(C[14]) -> 0.000987731337076315 | Q29: =RC[14]/SUM(C[14]) -> 0.00105065251050653 | R29: =RC[-12]*RC[-6] -> 0.0538625088589653 | S29: =RC[-12]*RC[-6] -> 0.0474111041796631 | T29: =RC[-12]*RC[-6] -> 0.0504313205043132 | U29: =RC[-12]*RC[-6] -> 0.0557593543653705 | V29: =RC[-12]*RC[-6] -> 0.0474111041796631 | W29: =RC[-12]*RC[-6] -> 0.0504313205043132 | X29: =R[-21]C -> 0.00448854240491377 | Y29: =RC[1]/SUM(C[1]) -> 0.00112213560122844 | Z29: =R[-21]C -> 38 | AA29: =R[-21]C -> 38 | AB29: =R[-21]C -> 38 | AC29: =R[-21]C -> 38 | AD29: =R[-21]C -> 38 | AE29: =R[-21]C -> 38 | AF29: =RC[-6] -> 38 | AG29: =RC[-6] -> 38 | AH29: =RC[-6] -> 38 | AI29: =RC[-6] -> 38 | AJ29: =RC[-6] -> 38 | AK29: =RC[-5] -> 38 | AL29: =RC[-5] -> 38 | AM29: =RC[-5] -> 38 | AN29: =RC[-5] -> 38 | AO29: =RC[-5] -> 38 | AP29: =RC[-5] -> 38 | AQ29: =RC[-5] -> 38 | AR29: =RC[-5] -> 38 | AS29: =RC[-5] -> 38 | AT29: =RC[-5] -> 38 | AU29: =RC[-5] -> 38 | AV29: =RC[-5] -> 38 | AW29: =RC[-5] -> 38 | AX29: =RC[-5] -> 38 | AY29: =RC[-5] -> 38 | AZ29: =RC[-5] -> 38 | BA29: =RC[-5] -> 38 | BB29: =RC[-5] -> 38 | BC29: =RC[-5] -> 38 | BD29: =RC[-5] -> 38 | BE29: =RC[-5] -> 38 | BF29: =RC[-5] -> 38 | BG29: =RC[-5] -> 38 | BH29: =RC[-5] -> 38 | BI29: =RC[-5] -> 38 | BJ29: =RC[-5] -> 38 | BK29: =RC[-5] -> 38 | BL29: =RC[-5] -> 38 | BM29: =RC[-5] -> 38 | BN29: =RC[-5] -> 38 | BO29: =RC[-5] -> 38 | BP29: =RC[-5] -> 38 | BQ29: =RC[-5] -> 38 | BR29: =RC[-5] -> 38 | BS29: =RC[-5] -> 38
A30: 27 | B30: A | C30: G | D30: 孔雀 | E30: 1026 | F30: =x!R[-20]C[-1] -> 8 | G30: =x!R[-20]C[-1] -> 24 | H30: =x!R[-20]C[-1] -> 12 | I30: =x!R[-20]C[-1] -> 12 | J30: =x!R[-20]C[-1] -> 24 | K30: =x!R[-20]C[-1] -> 24 | L30: =RC[14]/SUM(C[14]) -> 0.0510276399716513 | M30: =RC[14]/SUM(C[14]) -> 0.0149719276356831 | N30: =RC[14]/SUM(C[14]) -> 0.0318513603185136 | O30: =RC[14]/SUM(C[14]) -> 0.0352164343360235 | P30: =RC[14]/SUM(C[14]) -> 0.0149719276356831 | Q30: =RC[14]/SUM(C[14]) -> 0.0159256801592568 | R30: =RC[-12]*RC[-6] -> 0.40822111977321 | S30: =RC[-12]*RC[-6] -> 0.359326263256394 | T30: =RC[-12]*RC[-6] -> 0.382216323822163 | U30: =RC[-12]*RC[-6] -> 0.422597212032282 | V30: =RC[-12]*RC[-6] -> 0.359326263256394 | W30: =RC[-12]*RC[-6] -> 0.382216323822163 | X30: =SUM(RC[1]:R[1]C[1]) -> 0.102055279943303 | Y30: =RC[1]/SUM(C[1]) -> 0.0510276399716513 | Z30: =13824/RC[-20] -> 1728 | AA30: =13824/RC[-20] -> 576 | AB30: =13824/RC[-20] -> 1152 | AC30: =13824/RC[-20] -> 1152 | AD30: =13824/RC[-20] -> 576 | AE30: =13824/RC[-20] -> 576 | AF30: =RC[-6] -> 1728 | AG30: =RC[-6] -> 576 | AH30: =RC[-6] -> 1152 | AI30: =RC[-6] -> 1152 | AJ30: =RC[-6] -> 576 | AK30: =RC[-5] -> 1728 | AL30: =RC[-5] -> 576 | AM30: =RC[-5] -> 1152 | AN30: =RC[-5] -> 1152 | AO30: =RC[-5] -> 576 | AP30: =RC[-5] -> 1728 | AQ30: =RC[-5] -> 576 | AR30: =RC[-5] -> 1152 | AS30: =RC[-5] -> 1152 | AT30: =RC[-5] -> 576 | AU30: =RC[-5] -> 1728 | AV30: =RC[-5] -> 576 | AW30: =RC[-5] -> 1152 | AX30: =RC[-5] -> 1152 | AY30: =RC[-5] -> 576 | AZ30: =RC[-5] -> 1728 | BA30: =RC[-5] -> 576 | BB30: =RC[-5] -> 1152 | BC30: =RC[-5] -> 1152 | BD30: =RC[-5] -> 576 | BE30: =RC[-5] -> 1728 | BF30: =RC[-5] -> 576 | BG30: =RC[-5] -> 1152 | BH30: =RC[-5] -> 1152 | BI30: =RC[-5] -> 576 | BJ30: =RC[-5] -> 1728 | BK30: =RC[-5] -> 576 | BL30: =RC[-5] -> 1152 | BM30: =RC[-5] -> 1152 | BN30: =RC[-5] -> 576 | BO30: =RC[-5] -> 1728 | BP30: =RC[-5] -> 576 | BQ30: =RC[-5] -> 1152 | BR30: =RC[-5] -> 1152 | BS30: =RC[-5] -> 576
A31: 28 | B31: A | C31: G | D31: 孔雀 | E31: 1027 | F31: =R[-1]C -> 8 | G31: =R[-1]C -> 24 | H31: =R[-1]C -> 12 | I31: =R[-1]C -> 12 | J31: =R[-1]C -> 24 | K31: =R[-1]C -> 24 | L31: =RC[14]/SUM(C[14]) -> 0.0510276399716513 | M31: =RC[14]/SUM(C[14]) -> 0.0149719276356831 | N31: =RC[14]/SUM(C[14]) -> 0.0318513603185136 | O31: =RC[14]/SUM(C[14]) -> 0.0352164343360235 | P31: =RC[14]/SUM(C[14]) -> 0.0149719276356831 | Q31: =RC[14]/SUM(C[14]) -> 0.0159256801592568 | R31: =RC[-12]*RC[-6] -> 0.40822111977321 | S31: =RC[-12]*RC[-6] -> 0.359326263256394 | T31: =RC[-12]*RC[-6] -> 0.382216323822163 | U31: =RC[-12]*RC[-6] -> 0.422597212032282 | V31: =RC[-12]*RC[-6] -> 0.359326263256394 | W31: =RC[-12]*RC[-6] -> 0.382216323822163 | X31: =R[-1]C -> 0.102055279943303 | Y31: =RC[1]/SUM(C[1]) -> 0.0510276399716513 | Z31: =13824/RC[-20] -> 1728 | AA31: =13824/RC[-20] -> 576 | AB31: =13824/RC[-20] -> 1152 | AC31: =13824/RC[-20] -> 1152 | AD31: =13824/RC[-20] -> 576 | AE31: =13824/RC[-20] -> 576 | AF31: =RC[-6] -> 1728 | AG31: =RC[-6] -> 576 | AH31: =RC[-6] -> 1152 | AI31: =RC[-6] -> 1152 | AJ31: =RC[-6] -> 576 | AK31: =RC[-5] -> 1728 | AL31: =RC[-5] -> 576 | AM31: =RC[-5] -> 1152 | AN31: =RC[-5] -> 1152 | AO31: =RC[-5] -> 576 | AP31: =RC[-5] -> 1728 | AQ31: =RC[-5] -> 576 | AR31: =RC[-5] -> 1152 | AS31: =RC[-5] -> 1152 | AT31: =RC[-5] -> 576 | AU31: =RC[-5] -> 1728 | AV31: =RC[-5] -> 576 | AW31: =RC[-5] -> 1152 | AX31: =RC[-5] -> 1152 | AY31: =RC[-5] -> 576 | AZ31: =RC[-5] -> 1728 | BA31: =RC[-5] -> 576 | BB31: =RC[-5] -> 1152 | BC31: =RC[-5] -> 1152 | BD31: =RC[-5] -> 576 | BE31: =RC[-5] -> 1728 | BF31: =RC[-5] -> 576 | BG31: =RC[-5] -> 1152 | BH31: =RC[-5] -> 1152 | BI31: =RC[-5] -> 576 | BJ31: =RC[-5] -> 1728 | BK31: =RC[-5] -> 576 | BL31: =RC[-5] -> 1152 | BM31: =RC[-5] -> 1152 | BN31: =RC[-5] -> 576 | BO31: =RC[-5] -> 1728 | BP31: =RC[-5] -> 576 | BQ31: =RC[-5] -> 1152 | BR31: =RC[-5] -> 1152 | BS31: =RC[-5] -> 576

Sheet: x
A1: 类型 | B1: 所属大类 | C1: 中奖后 送灯数量 | D1: 说明 | E1: 随机倍率-档位-随机编号 | F1: 随机倍率-档位-随机编号 | G1: 随机倍率-档位-随机编号 | H1: 随机倍率-档位-随机编号 | I1: 随机倍率-档位-随机编号 | J1: 随机倍率-档位-随机编号 | K1: 随机倍率-档位-随机编号 | L1: 随机倍率-档位-随机编号 | M1: 随机倍率-档位-随机编号 | N1: 随机倍率-档位-随机编号 | O1: 随机倍率-档位-随机编号 | P1: 随机倍率-档位-随机编号 | Q1: 随机倍率-档位-随机编号 | R1: 随机倍率-档位-随机编号 | S1: 随机倍率-档位-随机编号 | T1: 随机倍率-档位-随机编号 | U1: 随机倍率-档位-随机编号 | V1: 随机倍率-档位-随机编号 | W1: 随机倍率-档位-随机编号 | X1: 随机倍率-档位-随机编号 | Y1: 随机倍率-档位-随机编号 | Z1: 随机倍率-档位-随机编号 | AA1: 随机倍率-档位-随机编号 | AB1: 随机倍率-档位-随机编号 | AC1: 随机倍率-档位-随机编号 | AD1: 随机倍率-档位-随机编号 | AE1: 随机倍率-档位-随机编号 | AF1: 随机倍率-档位-随机编号 | AG1: 随机倍率-档位-随机编号 | AH1: 随机倍率-档位-随机编号 | AI1: 随机倍率-档位-随机编号 | AJ1: 随机倍率-档位-随机编号 | AK1: 随机倍率-档位-随机编号 | AL1: 随机倍率-档位-随机编号 | AM1: 随机倍率-档位-随机编号 | AN1: 随机倍率-档位-随机编号 | AO1: 随机倍率-档位-随机编号 | AP1: 随机倍率-档位-随机编号 | AQ1: 随机倍率-档位-随机编号 | AR1: 随机倍率-档位-随机编号 | AS1: 随机倍率-档位-随机编号 | AT1: 随机倍率-档位-随机编号 | AU1: 随机倍率-档位-随机编号 | AV1: 随机倍率-档位-随机编号 | AW1: 随机倍率-档位-随机编号 | AX1: 随机倍率-档位-随机编号
A2: Sting | B2: String | C2: String | D2: String | E2: int | F2: int | G2: int | H2: int | I2: int | J2: int | K2: int | L2: int | M2: int | N2: int | O2: int | P2: int | Q2: int | R2: int | S2: int | T2: int | U2: int | V2: int | W2: int | X2: int | Y2: int | Z2: int | AA2: int | AB2: int | AC2: int | AD2: int | AE2: int | AF2: int | AG2: int | AH2: int | AI2: int | AJ2: int | AK2: int | AL2: int | AM2: int | AN2: int | AO2: int | AP2: int | AQ2: int | AR2: int | AS2: int | AT2: int | AU2: int | AV2: int | AW2: int | AX2: int
A3: type | B3: categray | C3: songDengCount | D3: dsc | E3: x-1-1 | F3: x-1-2 | G3: x-1-3 | H3: x-1-4 | I3: x-1-5 | J3: x-1-6 | K3: x-2-1 | L3: x-2-2 | M3: x-2-3 | N3: x-2-4 | O3: x-2-5 | P3: x-3-1 | Q3: x-3-2 | R3: x-3-3 | S3: x-3-4 | T3: x-3-5 | U3: x-4-1 | V3: x-4-2 | W3: x-4-3 | X3: x-4-4 | Y3: x-4-5 | Z3: x-5-1 | AA3: x-5-2 | AB3: x-5-3 | AC3: x-5-4 | AD3: x-5-5 | AE3: x-6-1 | AF3: x-6-2 | AG3: x-6-3 | AH3: x-6-4 | AI3: x-6-5 | AJ3: x-7-1 | AK3: x-7-2 | AL3: x-7-3 | AM3: x-7-4 | AN3: x-7-5 | AO3: x-8-1 | AP3: x-8-2 | AQ3: x-8-3 | AR3: x-8-4 | AS3: x-8-5 | AT3: x-9-1 | AU3: x-9-2 | AV3: x-9-3 | AW3: x-9-4 | AX3: x-9-5
A4: A | B4: A | C4: 0-0 | D4: 飞禽 | E4: 2 | F4: 2 | G4: 2 | H4: 2 | I4: 2 | J4: 2 | K4: =RC[-6] -> 2 | L4: =RC[-6] -> 2 | M4: =RC[-6] -> 2 | N4: =RC[-6] -> 2 | O4: =RC[-6] -> 2 | P4: =RC[-5] -> 2 | Q4: =RC[-5] -> 2 | R4: =RC[-5] -> 2 | S4: =RC[-5] -> 2 | T4: =RC[-5] -> 2 | U4: =RC[-5] -> 2 | V4: =RC[-5] -> 2 | W4: =RC[-5] -> 2 | X4: =RC[-5] -> 2 | Y4: =RC[-5] -> 2 | Z4: =RC[-5] -> 2 | AA4: =RC[-5] -> 2 | AB4: =RC[-5] -> 2 | AC4: =RC[-5] -> 2 | AD4: =RC[-5] -> 2 | AE4: =RC[-5] -> 2 | AF4: =RC[-5] -> 2 | AG4: =RC[-5] -> 2 | AH4: =RC[-5] -> 2 | AI4: =RC[-5] -> 2 | AJ4: =RC[-5] -> 2 | AK4: =RC[-5] -> 2 | AL4: =RC[-5] -> 2 | AM4: =RC[-5] -> 2 | AN4: =RC[-5] -> 2 | AO4: =RC[-5] -> 2 | AP4: =RC[-5] -> 2 | AQ4: =RC[-5] -> 2 | AR4: =RC[-5] -> 2 | AS4: =RC[-5] -> 2 | AT4: =RC[-5] -> 2 | AU4: =RC[-5] -> 2 | AV4: =RC[-5] -> 2 | AW4: =RC[-5] -> 2 | AX4: =RC[-5] -> 2
A5: B | B5: . | C5: 1-1 | D5: 银鲨鱼 | E5: 24 | F5: 24 | G5: 24 | H5: 24 | I5: 24 | J5: 24 | K5: =RC[-6] -> 24 | L5: =RC[-6] -> 24 | M5: =RC[-6] -> 24 | N5: =RC[-6] -> 24 | O5: =RC[-6] -> 24 | P5: =RC[-5] -> 24 | Q5: =RC[-5] -> 24 | R5: =RC[-5] -> 24 | S5: =RC[-5] -> 24 | T5: =RC[-5] -> 24 | U5: =RC[-5] -> 24 | V5: =RC[-5] -> 24 | W5: =RC[-5] -> 24 | X5: =RC[-5] -> 24 | Y5: =RC[-5] -> 24 | Z5: =RC[-5] -> 24 | AA5: =RC[-5] -> 24 | AB5: =RC[-5] -> 24 | AC5: =RC[-5] -> 24 | AD5: =RC[-5] -> 24 | AE5: =RC[-5] -> 24 | AF5: =RC[-5] -> 24 | AG5: =RC[-5] -> 24 | AH5: =RC[-5] -> 24 | AI5: =RC[-5] -> 24 | AJ5: =RC[-5] -> 24 | AK5: =RC[-5] -> 24 | AL5: =RC[-5] -> 24 | AM5: =RC[-5] -> 24 | AN5: =RC[-5] -> 24 | AO5: =RC[-5] -> 24 | AP5: =RC[-5] -> 24 | AQ5: =RC[-5] -> 24 | AR5: =RC[-5] -> 24 | AS5: =RC[-5] -> 24 | AT5: =RC[-5] -> 24 | AU5: =RC[-5] -> 24 | AV5: =RC[-5] -> 24 | AW5: =RC[-5] -> 24 | AX5: =RC[-5] -> 24
A6: C | B6: . | C6: 1-1 | D6: 金鲨鱼 | E6: 48 | F6: 48 | G6: 48 | H6: 48 | I6: 48 | J6: 48 | K6: =RC[-6] -> 48 | L6: =RC[-6] -> 48 | M6: =RC[-6] -> 48 | N6: =RC[-6] -> 48 | O6: =RC[-6] -> 48 | P6: =RC[-5] -> 48 | Q6: =RC[-5] -> 48 | R6: =RC[-5] -> 48 | S6: =RC[-5] -> 48 | T6: =RC[-5] -> 48 | U6: =RC[-5] -> 48 | V6: =RC[-5] -> 48 | W6: =RC[-5] -> 48 | X6: =RC[-5] -> 48 | Y6: =RC[-5] -> 48 | Z6: =RC[-5] -> 48 | AA6: =RC[-5] -> 48 | AB6: =RC[-5] -> 48 | AC6: =RC[-5] -> 48 | AD6: =RC[-5] -> 48 | AE6: =RC[-5] -> 48 | AF6: =RC[-5] -> 48 | AG6: =RC[-5] -> 48 | AH6: =RC[-5] -> 48 | AI6: =RC[-5] -> 48 | AJ6: =RC[-5] -> 48 | AK6: =RC[-5] -> 48 | AL6: =RC[-5] -> 48 | AM6: =RC[-5] -> 48 | AN6: =RC[-5] -> 48 | AO6: =RC[-5] -> 48 | AP6: =RC[-5] -> 48 | AQ6: =RC[-5] -> 48 | AR6: =RC[-5] -> 48 | AS6: =RC[-5] -> 48 | AT6: =RC[-5] -> 48 | AU6: =RC[-5] -> 48 | AV6: =RC[-5] -> 48 | AW6: =RC[-5] -> 48 | AX6: =RC[-5] -> 48
A7: D | B7: D | C7: 0-0 | D7: 走兽 | E7: 2 | F7: 2 | G7: 2 | H7: 2 | I7: 2 | J7: 2 | K7: =RC[-6] -> 2 | L7: =RC[-6] -> 2 | M7: =RC[-6] -> 2 | N7: =RC[-6] -> 2 | O7: =RC[-6] -> 2 | P7: =RC[-5] -> 2 | Q7: =RC[-5] -> 2 | R7: =RC[-5] -> 2 | S7: =RC[-5] -> 2 | T7: =RC[-5] -> 2 | U7: =RC[-5] -> 2 | V7: =RC[-5] -> 2 | W7: =RC[-5] -> 2 | X7: =RC[-5] -> 2 | Y7: =RC[-5] -> 2 | Z7: =RC[-5] -> 2 | AA7: =RC[-5] -> 2 | AB7: =RC[-5] -> 2 | AC7: =RC[-5] -> 2 | AD7: =RC[-5] -> 2 | AE7: =RC[-5] -> 2 | AF7: =RC[-5] -> 2 | AG7: =RC[-5] -> 2 | AH7: =RC[-5] -> 2 | AI7: =RC[-5] -> 2 | AJ7: =RC[-5] -> 2 | AK7: =RC[-5] -> 2 | AL7: =RC[-5] -> 2 | AM7: =RC[-5] -> 2 | AN7: =RC[-5] -> 2 | AO7: =RC[-5] -> 2 | AP7: =RC[-5] -> 2 | AQ7: =RC[-5] -> 2 | AR7: =RC[-5] -> 2 | AS7: =RC[-5] -> 2 | AT7: =RC[-5] -> 2 | AU7: =RC[-5] -> 2 | AV7: =RC[-5] -> 2 | AW7: =RC[-5] -> 2 | AX7: =RC[-5] -> 2
A8: E | B8: A | C8: 0-0 | D8: 燕子 | E8: 6 | F8: 3 | G8: 4 | H8: 6 | I8: 3 | J8: 4 | K8: =RC[-6] -> 6 | L8: =RC[-6] -> 3 | M8: =RC[-6] -> 4 | N8: =RC[-6] -> 6 | O8: =RC[-6] -> 3 | P8: =RC[-5] -> 6 | Q8: =RC[-5] -> 3 | R8: =RC[-5] -> 4 | S8: =RC[-5] -> 6 | T8: =RC[-5] -> 3 | U8: =RC[-5] -> 6 | V8: =RC[-5] -> 3 | W8: =RC[-5] -> 4 | X8: =RC[-5] -> 6 | Y8: =RC[-5] -> 3 | Z8: =RC[-5] -> 6 | AA8: =RC[-5] -> 3 | AB8: =RC[-5] -> 4 | AC8: =RC[-5] -> 6 | AD8: =RC[-5] -> 3 | AE8: =RC[-5] -> 6 | AF8: =RC[-5] -> 3 | AG8: =RC[-5] -> 4 | AH8: =RC[-5] -> 6 | AI8: =RC[-5] -> 3 | AJ8: =RC[-5] -> 6 | AK8: =RC[-5] -> 3 | AL8: =RC[-5] -> 4 | AM8: =RC[-5] -> 6 | AN8: =RC[-5] -> 3 | AO8: =RC[-5] -> 6 | AP8: =RC[-5] -> 3 | AQ8: =RC[-5] -> 4 | AR8: =RC[-5] -> 6 | AS8: =RC[-5] -> 3 | AT8: =RC[-5] -> 6 | AU8: =RC[-5] -> 3 | AV8: =RC[-5] -> 4 | AW8: =RC[-5] -> 6 | AX8: =RC[-5] -> 3
A9: F | B9: A | C9: 0-0 | D9: 鸽子 | E9: 6 | F9: 12 | G9: 8 | H9: 8 | I9: 12 | J9: 6 | K9: =RC[-6] -> 6 | L9: =RC[-6] -> 12 | M9: =RC[-6] -> 8 | N9: =RC[-6] -> 8 | O9: =RC[-6] -> 12 | P9: =RC[-5] -> 6 | Q9: =RC[-5] -> 12 | R9: =RC[-5] -> 8 | S9: =RC[-5] -> 8 | T9: =RC[-5] -> 12 | U9: =RC[-5] -> 6 | V9: =RC[-5] -> 12 | W9: =RC[-5] -> 8 | X9: =RC[-5] -> 8 | Y9: =RC[-5] -> 12 | Z9: =RC[-5] -> 6 | AA9: =RC[-5] -> 12 | AB9: =RC[-5] -> 8 | AC9: =RC[-5] -> 8 | AD9: =RC[-5] -> 12 | AE9: =RC[-5] -> 6 | AF9: =RC[-5] -> 12 | AG9: =RC[-5] -> 8 | AH9: =RC[-5] -> 8 | AI9: =RC[-5] -> 12 | AJ9: =RC[-5] -> 6 | AK9: =RC[-5] -> 12 | AL9: =RC[-5] -> 8 | AM9: =RC[-5] -> 8 | AN9: =RC[-5] -> 12 | AO9: =RC[-5] -> 6 | AP9: =RC[-5] -> 12 | AQ9: =RC[-5] -> 8 | AR9: =RC[-5] -> 8 | AS9: =RC[-5] -> 12 | AT9: =RC[-5] -> 6 | AU9: =RC[-5] -> 12 | AV9: =RC[-5] -> 8 | AW9: =RC[-5] -> 8 | AX9: =RC[-5] -> 12
A10: G | B10: A | C10: 0-0 | D10: 孔雀 | E10: 8 | F10: 24 | G10: 12 | H10: 12 | I10: 24 | J10: 24 | K10: =RC[-6] -> 8 | L10: =RC[-6] -> 24 | M10: =RC[-6] -> 12 | N10: =RC[-6] -> 12 | O10: =RC[-6] -> 24 | P10: =RC[-5] -> 8 | Q10: =RC[-5] -> 24 | R10: =RC[-5] -> 12 | S10: =RC[-5] -> 12 | T10: =RC[-5] -> 24 | U10: =RC[-5] -> 8 | V10: =RC[-5] -> 24 | W10: =RC[-5] -> 12 | X10: =RC[-5] -> 12 | Y10: =RC[-5] -> 24 | Z10: =RC[-5] -> 8 | AA10: =RC[-5] -> 24 | AB10: =RC[-5] -> 12 | AC10: =RC[-5] -> 12 | AD10: =RC[-5] -> 24 | AE10: =RC[-5] -> 8 | AF10: =RC[-5] -> 24 | AG10: =RC[-5] -> 12 | AH10: =RC[-5] -> 12 | AI10: =RC[-5] -> 24 | AJ10: =RC[-5] -> 8 | AK10: =RC[-5] -> 24 | AL10: =RC[-5] -> 12 | AM10: =RC[-5] -> 12 | AN10: =RC[-5] -> 24 | AO10: =RC[-5] -> 8 | AP10: =RC[-5] -> 24 | AQ10: =RC[-5] -> 12 | AR10: =RC[-5] -> 12 | AS10: =RC[-5] -> 24 | AT10: =RC[-5] -> 8 | AU10: =RC[-5] -> 24 | AV10: =RC[-5] -> 12 | AW10: =RC[-5] -> 12 | AX10: =RC[-5] -> 24
A11: H | B11: A | C11: 0-0 | D11: 老鹰 | E11: 24 | F11: 24 | G11: 24 | H11: 12 | I11: 24 | J11: 24 | K11: =RC[-6] -> 24 | L11: =RC[-6] -> 24 | M11: =RC[-6] -> 24 | N11: =RC[-6] -> 12 | O11: =RC[-6] -> 24 | P11: =RC[-5] -> 24 | Q11: =RC[-5] -> 24 | R11: =RC[-5] -> 24 | S11: =RC[-5] -> 12 | T11: =RC[-5] -> 24 | U11: =RC[-5] -> 24 | V11: =RC[-5] -> 24 | W11: =RC[-5] -> 24 | X11: =RC[-5] -> 12 | Y11: =RC[-5] -> 24 | Z11: =RC[-5] -> 24 | AA11: =RC[-5] -> 24 | AB11: =RC[-5] -> 24 | AC11: =RC[-5] -> 12 | AD11: =RC[-5] -> 24 | AE11: =RC[-5] -> 24 | AF11: =RC[-5] -> 24 | AG11: =RC[-5] -> 24 | AH11: =RC[-5] -> 12 | AI11: =RC[-5] -> 24 | AJ11: =RC[-5] -> 24 | AK11: =RC[-5] -> 24 | AL11: =RC[-5] -> 24 | AM11: =RC[-5] -> 12 | AN11: =RC[-5] -> 24 | AO11: =RC[-5] -> 24 | AP11: =RC[-5] -> 24 | AQ11: =RC[-5] -> 24 | AR11: =RC[-5] -> 12 | AS11: =RC[-5] -> 24 | AT11: =RC[-5] -> 24 | AU11: =RC[-5] -> 24 | AV11: =RC[-5] -> 24 | AW11: =RC[-5] -> 12 | AX11: =RC[-5] -> 24
A12: I | B12: D | C12: 0-0 | D12: 狮子 | E12: 24 | F12: 24 | G12: 24 | H12: 12 | I12: 24 | J12: 24 | K12: =RC[-6] -> 24 | L12: =RC[-6] -> 24 | M12: =RC[-6] -> 24 | N12: =RC[-6] -> 12 | O12: =RC[-6] -> 24 | P12: =RC[-5] -> 24 | Q12: =RC[-5] -> 24 | R12: =RC[-5] -> 24 | S12: =RC[-5] -> 12 | T12: =RC[-5] -> 24 | U12: =RC[-5] -> 24 | V12: =RC[-5] -> 24 | W12: =RC[-5] -> 24 | X12: =RC[-5] -> 12 | Y12: =RC[-5] -> 24 | Z12: =RC[-5] -> 24 | AA12: =RC[-5] -> 24 | AB12: =RC[-5] -> 24 | AC12: =RC[-5] -> 12 | AD12: =RC[-5] -> 24 | AE12: =RC[-5] -> 24 | AF12: =RC[-5] -> 24 | AG12: =RC[-5] -> 24 | AH12: =RC[-5] -> 12 | AI12: =RC[-5] -> 24 | AJ12: =RC[-5] -> 24 | AK12: =RC[-5] -> 24 | AL12: =RC[-5] -> 24 | AM12: =RC[-5] -> 12 | AN12: =RC[-5] -> 24 | AO12: =RC[-5] -> 24 | AP12: =RC[-5] -> 24 | AQ12: =RC[-5] -> 24 | AR12: =RC[-5] -> 12 | AS12: =RC[-5] -> 24 | AT12: =RC[-5] -> 24 | AU12: =RC[-5] -> 24 | AV12: =RC[-5] -> 24 | AW12: =RC[-5] -> 12 | AX12: =RC[-5] -> 24
A13: J | B13: D | C13: 0-0 | D13: 熊猫 | E13: 8 | F13: 24 | G13: 12 | H13: 12 | I13: 24 | J13: 24 | K13: =RC[-6] -> 8 | L13: =RC[-6] -> 24 | M13: =RC[-6] -> 12 | N13: =RC[-6] -> 12 | O13: =RC[-6] -> 24 | P13: =RC[-5] -> 8 | Q13: =RC[-5] -> 24 | R13: =RC[-5] -> 12 | S13: =RC[-5] -> 12 | T13: =RC[-5] -> 24 | U13: =RC[-5] -> 8 | V13: =RC[-5] -> 24 | W13: =RC[-5] -> 12 | X13: =RC[-5] -> 12 | Y13: =RC[-5] -> 24 | Z13: =RC[-5] -> 8 | AA13: =RC[-5] -> 24 | AB13: =RC[-5] -> 12 | AC13: =RC[-5] -> 12 | AD13: =RC[-5] -> 24 | AE13: =RC[-5] -> 8 | AF13: =RC[-5] -> 24 | AG13: =RC[-5] -> 12 | AH13: =RC[-5] -> 12 | AI13: =RC[-5] -> 24 | AJ13: =RC[-5] -> 8 | AK13: =RC[-5] -> 24 | AL13: =RC[-5] -> 12 | AM13: =RC[-5] -> 12 | AN13: =RC[-5] -> 24 | AO13: =RC[-5] -> 8 | AP13: =RC[-5] -> 24 | AQ13: =RC[-5] -> 12 | AR13: =RC[-5] -> 12 | AS13: =RC[-5] -> 24 | AT13: =RC[-5] -> 8 | AU13: =RC[-5] -> 24 | AV13: =RC[-5] -> 12 | AW13: =RC[-5] -> 12 | AX13: =RC[-5] -> 24
A14: K | B14: D | C14: 0-0 | D14: 猴子 | E14: 6 | F14: 12 | G14: 8 | H14: 8 | I14: 12 | J14: 6 | K14: =RC[-6] -> 6 | L14: =RC[-6] -> 12 | M14: =RC[-6] -> 8 | N14: =RC[-6] -> 8 | O14: =RC[-6] -> 12 | P14: =RC[-5] -> 6 | Q14: =RC[-5] -> 12 | R14: =RC[-5] -> 8 | S14: =RC[-5] -> 8 | T14: =RC[-5] -> 12 | U14: =RC[-5] -> 6 | V14: =RC[-5] -> 12 | W14: =RC[-5] -> 8 | X14: =RC[-5] -> 8 | Y14: =RC[-5] -> 12 | Z14: =RC[-5] -> 6 | AA14: =RC[-5] -> 12 | AB14: =RC[-5] -> 8 | AC14: =RC[-5] -> 8 | AD14: =RC[-5] -> 12 | AE14: =RC[-5] -> 6 | AF14: =RC[-5] -> 12 | AG14: =RC[-5] -> 8 | AH14: =RC[-5] -> 8 | AI14: =RC[-5] -> 12 | AJ14: =RC[-5] -> 6 | AK14: =RC[-5] -> 12 | AL14: =RC[-5] -> 8 | AM14: =RC[-5] -> 8 | AN14: =RC[-5] -> 12 | AO14: =RC[-5] -> 6 | AP14: =RC[-5] -> 12 | AQ14: =RC[-5] -> 8 | AR14: =RC[-5] -> 8 | AS14: =RC[-5] -> 12 | AT14: =RC[-5] -> 6 | AU14: =RC[-5] -> 12 | AV14: =RC[-5] -> 8 | AW14: =RC[-5] -> 8 | AX14: =RC[-5] -> 12
A15: L | B15: D | C15: 0-0 | D15: 兔子 | E15: 6 | F15: 3 | G15: 4 | H15: 6 | I15: 3 | J15: 4 | K15: =RC[-6] -> 6 | L15: =RC[-6] -> 3 | M15: =RC[-6] -> 4 | N15: =RC[-6] -> 6 | O15: =RC[-6] -> 3 | P15: =RC[-5] -> 6 | Q15: =RC[-5] -> 3 | R15: =RC[-5] -> 4 | S15: =RC[-5] -> 6 | T15: =RC[-5] -> 3 | U15: =RC[-5] -> 6 | V15: =RC[-5] -> 3 | W15: =RC[-5] -> 4 | X15: =RC[-5] -> 6 | Y15: =RC[-5] -> 3 | Z15: =RC[-5] -> 6 | AA15: =RC[-5] -> 3 | AB15: =RC[-5] -> 4 | AC15: =RC[-5] -> 6 | AD15: =RC[-5] -> 3 | AE15: =RC[-5] -> 6 | AF15: =RC[-5] -> 3 | AG15: =RC[-5] -> 4 | AH15: =RC[-5] -> 6 | AI15: =RC[-5] -> 3 | AJ15: =RC[-5] -> 6 | AK15: =RC[-5] -> 3 | AL15: =RC[-5] -> 4 | AM15: =RC[-5] -> 6 | AN15: =RC[-5] -> 3 | AO15: =RC[-5] -> 6 | AP15: =RC[-5] -> 3 | AQ15: =RC[-5] -> 4 | AR15: =RC[-5] -> 6 | AS15: =RC[-5] -> 3 | AT15: =RC[-5] -> 6 | AU15: =RC[-5] -> 3 | AV15: =RC[-5] -> 4 | AW15: =RC[-5] -> 6 | AX15: =RC[-5] -> 3

Sheet: normalWeights
A1: 名字 | B1: 倍率 | C1: 权重 | D1: 概率 | E1: 压分 | F1: 回报率 | G1: 总回报率
A2: String | B2: int | C2: int | D2: double | E2: int | F2: double | G2: double
A3: name | B3: x | C3: weight | D3: probability | E3: count | F3: back | G3: allBack
A4: 金鲨鱼 | B4: 99 | C4: 100 | D4: =RC[-1]/SUM(C[-1]) -> 0.00340136054421769 | E4: 1 | F4: =RC[-2]*RC[-4] -> 0.336734693877551 | G4: =AVERAGE(C[-1]) -> 0.858163265306123
A5: 银鲨鱼 | B5: 24 | C5: 500 | D5: =RC[-1]/SUM(C[-1]) -> 0.0170068027210884 | E5: 1 | F5: =RC[-2]*RC[-4] -> 0.408163265306122 | G5: =AVERAGE(C[-1]) -> 0.858163265306123
A6: 老鹰 | B6: 12 | C6: 2400 | D6: =RC[-1]/SUM(C[-1]) -> 0.0816326530612245 | E6: 1 | F6: =RC[-2]*RC[-4] -> 0.979591836734694 | G6: =AVERAGE(C[-1]) -> 0.858163265306123
A7: 狮子 | B7: 12 | C7: 2400 | D7: =RC[-1]/SUM(C[-1]) -> 0.0816326530612245 | E7: 1 | F7: =RC[-2]*RC[-4] -> 0.979591836734694 | G7: =AVERAGE(C[-1]) -> 0.858163265306123
A8: 孔雀 | B8: 8 | C8: 3600 | D8: =RC[-1]/SUM(C[-1]) -> 0.122448979591837 | E8: 1 | F8: =RC[-2]*RC[-4] -> 0.979591836734694 | G8: =AVERAGE(C[-1]) -> 0.858163265306123
A9: 熊猫 | B9: 8 | C9: 3600 | D9: =RC[-1]/SUM(C[-1]) -> 0.122448979591837 | E9: 1 | F9: =RC[-2]*RC[-4] -> 0.979591836734694 | G9: =AVERAGE(C[-1]) -> 0.858163265306123
A10: 猴子 | B10: 8 | C10: 3600 | D10: =RC[-1]/SUM(C[-1]) -> 0.122448979591837 | E10: 1 | F10: =RC[-2]*RC[-4] -> 0.979591836734694 | G10: =AVERAGE(C[-1]) -> 0.858163265306123
A11: 鸽子 | B11: 8 | C11: 3600 | D11: =RC[-1]/SUM(C[-1]) -> 0.122448979591837 | E11: 1 | F11: =RC[-2]*RC[-4] -> 0.979591836734694 | G11: =AVERAGE(C[-1]) -> 0.858163265306123
A12: 燕子 | B12: 6 | C12: 4800 | D12: =RC[-1]/SUM(C[-1]) -> 0.163265306122449 | E12: 1 | F12: =RC[-2]*RC[-4] -> 0.979591836734694 | G12: =AVERAGE(C[-1]) -> 0.858163265306123
A13: 兔子 | B13: 6 | C13: 4800 | D13: =RC[-1]/SUM(C[-1]) -> 0.163265306122449 | E13: 1 | F13: =RC[-2]*RC[-4] -> 0.979591836734694 | G13: =AVERAGE(C[-1]) -> 0.858163265306123

Sheet: const
A1: 常量名 | B1: 值 | C1: 说明
A2: String | B2: String | C2: String
A3: name | B3: value | C3: dsc
A4: CD | B4: 30000 | C4: 开奖时间间隔(毫秒)
A5: JIE_SUAN_CD | B5: 10000 | C5: 等待结算时长(毫秒) 开奖后, 进入下一轮的等待时间
A6: HAN_HUA_LA_BA | B6: 1 | C6: 喊话所需金币
A7: HAN_HUA_MESSAGE_LEN | B7: 50 | C7: 喊话消息长度限制
A8: MAX_MESSAGE_COUNT | B8: 20 | C8: 服务器保留最近喊话消息数量 的最大值
A9: COIN_RECEIVE | B9: 1000 | C9: 每次领取到的金币数量
A10: COIN_RECEIVE_CONDITION | B10: =R[-1]C -> 1000 | C10: 玩家金币小于这个值的时候, 才可以领取金币
A11: COIN_RECEIVE_TIME_SPACE | B11: =60000*60*3 -> 10800000 | C11: 金币领取时间间隔, 毫秒
A12: CAI_JIN_LOWEST | B12: 5000000 | C12: 彩金池内最低彩金
A13: CAI_JIN_SCALE | B13: 0.1-0.5 | C13: 系统盈利的10%-50%随机放入彩金池中
A14: CAI_JIN_RECEIVE_SCALE_BIG | B14: 0.01-0.03 | C14: 大彩金获得比例(随机)
A15: CAI_JIN_CONDITION | B15: 5000 | C15: 大彩金:押注鲨鱼金额超过 >= CAI_JIN_CONDITION ，且该轮命中鲨鱼时，有几率系统彩金发放给命中鲨鱼的玩家；
A16: CAI_JIN_L | B16: 50000000 | C16: 彩金库 大于该值 出大彩金,否则出小彩金
A17: CAI_JIN_PERSON_MAX | B17: 1000000 | C17: 每人每次最多获得彩金的数量
A18: CAI_JIN_CONDITION_SMALL | B18: 5000 | C18: 小彩金:同上
A19: CAI_JIN_X_SMALL | B19: 10 | C19: 小彩金:必须要这个灯的倍率大于等于该值, 才会触发小彩金
A20: CAI_JIN_PROBABILITY_SMALL | B20: 0 | C20: 小彩金出现概率
A21: CAI_JIN_SCALE_SMALL | B21: 0.1-0.1 | C21: 小彩金出现后, 彩金池的CAI_JIN_SCALE_SMALL%会拿给 所有中奖者平分, CAI_JIN_SCALE_SMALL在 10%到10%随机
A22: ROBOT_COMMIT_COUNT | B22: 0-1 | C22: 机器人每次下注项数(范围) 格式: 最小值-最大值
A23: ROBOT_COMMIT_COIN | B23: 100-20000 | C23: 机器人下注时 每项下注金额(范围) 格式: 最小值-最大值
A24: ROBOT_COMMIT_SEC | B24: 5,7,9,11,13,15,17,19,21,23,25 | C24: 机器人下注时间点, 其中有多少个值, 机器人就会下注多少次
A25: SEND_GOLD_MIN | B25: 100000 | C25: 赠送金豆 最低额度
A26: SEND_GOLD_REMAIN_MIN | B26: 10000 | C26: 赠送金币后, 自身至少应该留多少钱
A27: SEND_GOLD_MAX | B27: 100000000 | C27: 赠送金豆 最高额度
A28: SEND_GOLD_UNIT | B28: 1 | C28: 赠送金豆的单位, 必须为该值的整数倍
A29: SEND_GOLD_POUNDAGE | B29: 0 | C29: 赠送金币手续费率, 由获得方支付
A30: SEND_GOLD_POUNDAGE_MAX | B30: 100000 | C30: 赠送金豆最高手续费
A31: BANK_PASSWORD_UNLOCK_SEC | B31: 86400 | C31: 强制解锁所需时间
A32: SHANG_ZHUANG_COIN_MIN | B32: 10000000 | C32: 执行上庄操作者自身携带游戏币不能低于%s0
A33: CREATE_ROLE_SEND_COIN | B33: 3000 | C33: 创建角色时, 赠送金豆的数量
A34: CREATE_ROLE_SEND_LABA | B34: 5 | C34: 创建角色时, 赠送喇叭的数量
A35: MAX_ZHUANG_TIMES | B35: 5 | C35: 最大坐庄次数
A36: JIN_SHA_YU_PAUSE_SEC | B36: 20 | C36: 出现金鲨鱼后,全局暂停时间(秒)
A37: JIANG_QUAN_CAI_JIN_MIN | B37: 10000 | C37: 至少获得JIANG_QUAN_CAI_JIN_MIN彩金时, 才会获得奖券
A38: JIANG_QUAN_SCALE | B38: 0.0001 | C38: 奖券获得比例 奖券:获得彩金
A39: TUN_FEN_GAI_LV | B39: 0.8 | C39: 每轮必出吞分结果的概率
A40: KU_CUN_SHUAI_JIAN_MIN | B40: 0 | C40: 只要库存大于该值,库存就会持续衰减
A41: DAY_SEND_LABA | B41: 20 | C41: 每天登入送5个喇叭
A42: IS_TU_FEN_BY_PERSON_COUNT_PROB | B42: 0.9 | C42: 在吐分的时候, 有90%的概率吐分到下注玩家最多的灯上

Sheet: messages
A1: 消息id | B1: 值 | C1: 使用地点
A2: int | B2: String | C2: String
A3: id | B3: value | C3: dsc
A4: 10001 | B4: %s0 | C4: 这个不要改
A5: 10002 | B5: 网络异常,请重新登陆 | C5: 登陆时
A6: 10003 | B6: token error | C6: 登陆时
A7: 10004 | B7: 包含敏感词 | C7: 创建角色,发送消息等等
A8: 10005 | B8: 网络异常,请重新登陆 | C8: 登陆成功后,接入游戏服务器
A9: 10006 | B9: 角色不存在 | C9: 登陆时
A10: 10007 | B10: 你还没有进入游戏选定角色 | C10: 登陆成功后,选定角色
A11: 10008 | B11: 消息长度必须小于 < %s0 | C11: 喊话
A12: 10009 | B12: 金豆数量不足，请充值！ | C12: 买东西等等
A13: 10010 | B13: 包含敏感词 | C13: 创建角色,发送消息等等
A14: 10011 | B14: 已经结算了 | C14: 游戏进行时
A15: 10012 | B15: 网络异常:[%s0] message:[%s1] | C15: 游戏进行时
A16: 10013 | B16: ="金豆数量超过"&const!R[-6]C&"，领取失败" -> 金豆数量超过1000，领取失败 | C16: 领取金豆
A17: 10014 | B17: 你被封号了 | C17: 登陆时
A18: 10015 | B18: 你被禁言了 | C18: 发送消息时
A19: 10016 | B19: 你的帐号是个机器人,无法登陆 | C19: 登陆时
A20: 10017 | B20: 恭喜 [%s0] 获得 [%s1] 彩金 | C20: 游戏进行中,某人获得了彩金
A21: 10018 | B21: 赠送后玩家自身携带游戏币不能低于 %s0 | C21: 赠送金豆
A22: 10019 | B22: 赠送单位为 %s0 | C22: 赠送金豆
A23: 10020 | B23: 每次最低为 %s0 | C23: 赠送金豆
A24: 10021 | B24: 每次最高为 %s0 | C24: 赠送金豆
A25: 10022 | B25: 喇叭数量不足，请购买后执行此操作！ | C25: 喊话
A26: 10023 | B26: %s0不够 | C26: 各种地方,某种物品不够消耗
A27: 10024 | B27: 执行上庄操作者自身携带游戏币不能低于%s0 | C27: 上庄时
A28: 10025 | B28: 昵称已被占用，请重新输入！ | C28: 创建角色时
A29: 10026 | B29: 密码不能为空 | C29: 绑定账号+密码
A30: 10027 | B30: 密码长度在%s0到%s1之间 | C30: 绑定账号+密码
A31: 10028 | B31: 密码错误 | C31: 绑定账号+密码
A32: 10029 | B32: 您正在坐庄,不能下注 | C32: 坐庄时
A33: 10030 | B33: 金豆数量不足！ | C33: 扣金币时
A34: 10031 | B34: 用户不存在 | C34: 登陆时
A35: 10032 | B35: 正在排队 | C35: 申请坐庄
A36: 10033 | B36: 仓库存储数量已达上限！ | C36: 存钱
A37: 10034 | B37: 对不起,您正在坐庄 | C37: 当玩家正在坐庄的时候, 点击上庄时
A38: 10035 | B38: 商品已经下架 | C38: 购买不存在的物品时
A39: 10036 | B39: 账号含有非法字符！ | C39: 注册账号-账号输入框
A40: 10037 | B40: 账号已使用！ | C40: 注册账号-账号输入框
A41: 10038 | B41: 账号长度为6-16位！ | C41: 注册账号-账号输入框-提示信息
A42: 10039 | B42: 账号长度不能低于6位！ | C42: 注册账号-账号输入框-提示信息
A43: 10040 | B43: 密码含有非法字符！ | C43: 注册账号-密码输入框
A44: 10041 | B44: 密码长度为6-16位！ | C44: 注册账号-密码输入框-提示信息
A45: 10042 | B45: 密码含有非法字符！ | C45: 注册账号-确认密码输入框
A46: 10043 | B46: 密码长度不能低于6位！ | C46: 注册账号-密码输入框-提示信息
A47: 10044 | B47: 密码输入不相同！ | C47: 注册账号-确认密码输入框
A48: 10045 | B48: 密码长度为6-16位！ | C48: 注册账号-确认密码输入框-提示信息
A49: 10046 | B49: 注册成功！ | C49: 注册账号
A50: 10047 | B50: 账号或密码输入错误！ | C50: 登录账号-账号输入框
A51: 10048 | B51: 账号或密码输入错误！ | C51: 登录账号-账号输入框
A52: 10049 | B52: 登录成功！ | C52: 登录账号
A53: 10050 | B53: 请输入游戏账号，登录密码将发送到账号同名邮箱内！ | C53: 忘记密码-密码发送邮箱-功能介绍文字
A54: 10051 | B54: 密码已发送至邮箱，请及时查收！ | C54: 忘记密码-密码发送邮箱
A55: 10052 | B55: 昵称已使用，请重新输入！ | C55: 注册昵称-昵称输入框
A56: 10053 | B56: 昵称含有非法字符，请重新输入！ | C56: 注册昵称-昵称输入框
A57: 10054 | B57: 注册成功！ | C57: 注册昵称
A58: 10055 | B58: 金豆取回成功！ | C58: 仓库-金豆取回
A59: 10056 | B59: 自身携带金豆超过携带上限，取回失败！ | C59: 仓库-金豆取回
A60: 10057 | B60: 金豆取回数量不能为0！ | C60: 仓库-金豆取回
A61: 10058 | B61: 请在此输入金豆数量！ | C61: 仓库-金豆输入框-金豆输入处通用
A62: 10059 | B62: 金豆存入成功！ | C62: 仓库-金豆存入
A63: 10060 | B63: 金豆存入数量不能为0！ | C63: 仓库-金豆存入
A64: 10061 | B64: 仓库金豆超过存储上限，存入失败！ | C64: 仓库-金豆存入
A65: 10062 | B65: 赠送成功！ | C65: 仓库-赠送-赠
A66: 10063 | B66: 赠送ID不存在，请输入正确ID或昵称！ | C66: 仓库-赠送-赠
A67: 10064 | B67: 赠送昵称不存在，请输入正确ID或昵称！ | C67: 仓库-赠送-赠
A68: 10065 | B68: 赠送金豆数量最低不能低于 1万！ | C68: 仓库-赠送-赠
A69: 10066 | B69: 赠送金豆数量最高不能超过 1亿！ | C69: 仓库-赠送-赠
A70: 10067 | B70: 密码输入错误！ | C70: 仓库-赠送-密码输入框
A71: 10068 | B71: 密码输入正确！ | C71: 仓库-赠送-密码输入框
A72: 10069 | B72: 确定给ID：XX，昵称:XX的玩家赠送XX金豆？ | C72: 仓库-赠送-赠送提示框提示文字
A73: 10070 | B73: 1、使用金豆赠送后自身携带金豆数量不能低于 1万 。 2、金豆赠送数量每次最低为 1万 。 3、金豆赠送数量每次最高为 1亿 。 4、每次使用金豆赠送时，系统将抽取金豆获得方获得的金豆数量 1％ 。 5、金豆赠送数量大于或者等于 1000万 者，抽取金豆获得方最高 10万 金豆。 | C73: 仓库-赠送规则介绍文字
A74: 10071 | B74: 收到XX赠送金豆XX， | C74: 仓库-赠送-收
A75: 10072 | B75: 密码含有非法字符！ | C75: 安全锁-设置-安全密码输入框
A76: 10073 | B76: 密码长度为6-16位！ | C76: 安全锁-设置-安全密码输入框-提示信息
A77: 10074 | B77: 密码含有非法字符！ | C77: 安全锁-设置-确认密码输入框
A78: 10075 | B78: 密码输入不相同！ | C78: 安全锁-设置-确认密码输入框
A79: 10076 | B79: 密码长度为6-16位！ | C79: 安全锁-设置-确认密码输入框-提示信息
A80: 10077 | B80: 安全锁密码设置成功！ | C80: 安全锁-设置
A81: 10078 | B81: 设置密码后，您的仓库金豆取回与赠送时，将需要输入正确的密码才能使用，开启后将提高您的游戏安全性！ | C81: 安全锁-设置-安全锁功能文字介绍
A82: 10079 | B82: 请输入原始密码！ | C82: 安全锁-修改-旧密码输入框-提示信息
A83: 10080 | B83: 密码输入错误！ | C83: 安全锁-修改-旧密码输入框
A84: 10081 | B84: 密码长度为6-16位！ | C84: 安全锁-修改-新密码输入框-提示信息
A85: 10082 | B85: 密码含有非法字符！ | C85: 安全锁-修改-新密码输入框
A86: 10083 | B86: 密码长度不能低于6位！ | C86: 安全锁-修改-新密码输入框-提示信息
A87: 10084 | B87: 密码长度为6-16位！ | C87: 安全锁-修改-确认密码输入框-提示信息
A88: 10085 | B88: 密码含有非法字符！ | C88: 安全锁-修改-确认密码输入框
A89: 10086 | B89: 密码长度不能低于6位！ | C89: 安全锁-修改-确认密码输入框-提示信息
A90: 10087 | B90: 密码修改成功！ | C90: 安全锁-修改
A91: 10088 | B91: 安全锁强制解锁成功！ | C91: 安全锁-强制解锁
A92: 10089 | B92: 强制解锁已取消！ | C92: 安全锁-强制解锁
A93: 10090 | B93: 免费领取金豆成功！ | C93: 免费领取金豆-领取
A94: 10091 | B94: 购买XX喇叭成功 | C94: 购买-道具
A95: 10092 | B95: 金豆数量不足，请充值！ | C95: 购买-道具
A96: 10093 | B96: 充值成功！ | C96: 购买-支付宝充值
A97: 10094 | B97: 充值成功！ | C97: 购买-话费充值
A98: 10095 | B98: 充值成功！ | C98: 购买-其他充值
A99: 10096 | B99: 声音开启！ | C99: 声音开关-开启
A100: 10097 | B100: 声音关闭！ | C100: 声音开关-关闭
A101: 10098 | B101: 信息不能为空！ | C101: 世界聊天-聊天
A102: 10099 | B102: 喇叭不足，请购买！ | C102: 世界聊天-聊天
A103: 10100 | B103: 信息发送频率过快，请稍后在发！ | C103: 世界聊天-聊天
A104: 10101 | B104: 上庄成功！ | C104: 游戏房间-上庄
A105: 10102 | B105: 下庄成功！ | C105: 游戏房间-下庄
A106: 10103 | B106: 本轮坐庄结算后，下轮游戏将以普通玩家状态游玩游戏！确定不再坐庄？ | C106: 游戏房间-下庄
A107: 10104 | B107: 游戏玩法： 玩家进入游戏之后，可以使用切换按钮来选择下注金豆的额度。 玩家会有30秒的时间来进行对各种动物的押分，每个动物的押分比例会随着系统的变化而变化。 当玩家获得彩金时，可获得一定数量的彩金奖。 功能介绍： 游戏大厅 安全锁： 设置安全锁 - 开启后，仓库取出金豆和赠送金豆操作时，将需要密码。 修改密码 - 修改安全锁密码。 强制解锁 - 忘记安全锁密码后，可以在此执行强制解锁，强制解锁开启24小时无人申诉后，安全锁将被解开。 仓库： 仓库存金豆 - 把自身的金豆存放在仓库。 仓库取金豆 - 把仓库的金豆取回到自身。 仓库赠送金豆 - 可以把自身的金豆赠送给好友。 领取金豆： 免费领取 - 自身金豆低于1000时，可以领取。 设置： 帮助 - 游戏功能介绍与玩法。 声音开关 - 开启与关闭声音。 账户 - 查看个人信息以及绑定个人信息。 游戏房间 菜单： 玩家列表 - 可以查看当前在线玩家。 上庄列表 - 可以查看当前上庄等待玩家。 奖杯： 彩金发放历史榜单 - 可以在此查看最近的游戏彩金发放记录。 按钮： 动物按钮 - 点击后可以执行游戏押分操作。 切换按钮 - 切换后，每次执行押分操作，押得积分都将不同。 上庄按钮 - 点击后，进入等待上庄列表，成功上庄后，只需等待每轮游戏结束即可，不能押分。 下庄按钮 - 点击后，完成当前庄家状态后，次轮将下庄成为普通玩家。 续押按钮 - 点击后，自动重复与上轮相同押分操作。 取消按钮 - 押分后，可以点击此按钮取消当前所押积分。 世界广播 聊天： 喇叭聊天 - 可以在游戏内交流喊话，每次消耗一个喇叭。 | C107: 帮助界面-文本介绍
A108: 10105 | B108: 您的金豆数量为0，请充值后在执行此操作！ | C108: 游戏房间-金豆不足
A109: 10106 | B109: 您的金豆数量不足1000万，请充值后在执行此操作！ | C109: 游戏房间-上庄
A110: 10107 | B110: 恭喜[%s0]获得彩金%s1 | C110: 当玩家获得彩金全服公告
A111: 10108 | B111: 系统 | C111: 发送全服滚屏公告时,前缀
A112: 10109 | B112: 不能给自己赠送金豆 | C112: 赠送金豆时
A113: 10110 | B113: x | C113: x
A114: 10111 | B114: x | C114: x
A115: 10112 | B115: x | C115: x
A116: 10113 | B116: x | C116: x
A117: 10114 | B117: x | C117: x
A118: 10115 | B118: x | C118: x
A119: 10116 | B119: x | C119: x
A120: 10117 | B120: x | C120: x
A121: 10118 | B121: x | C121: x
A122: 10119 | B122: x | C122: x
A123: 10120 | B123: x | C123: x
A124: 10121 | B124: x | C124: x
A125: 10122 | B125: x | C125: x
A126: 10123 | B126: x | C126: x
A127: 10124 | B127: x | C127: x
A128: 10125 | B128: x | C128: x
A129: 10126 | B129: x | C129: x
A130: 10127 | B130: x | C130: x
A131: 10128 | B131: x | C131: x
A132: 10129 | B132: x | C132: x
A133: 10130 | B133: x | C133: x
A134: 10131 | B134: x | C134: x
A135: 10132 | B135: x | C135: x
A136: 10133 | B136: x | C136: x
A137: 10134 | B137: x | C137: x
A138: 10135 | B138: x | C138: x
A139: 10136 | B139: x | C139: x
A140: 10137 | B140: x | C140: x
A141: 10138 | B141: x | C141: x
A142: 10139 | B142: x | C142: x
A143: 10140 | B143: x | C143: x
A144: 10141 | B144: x | C144: x
A145: 10142 | B145: x | C145: x
A146: 10143 | B146: x | C146: x
A147: 10144 | B147: x | C147: x
A148: 10145 | B148: x | C148: x
A149: 10146 | B149: x | C149: x
A150: 10147 | B150: x | C150: x
A151: 10148 | B151: x | C151: x
A152: 10149 | B152: x | C152: x
A153: 10150 | B153: x | C153: x
A154: 10151 | B154: x | C154: x
A155: 10152 | B155: x | C155: x
A156: 10153 | B156: x | C156: x
A157: 10154 | B157: x | C157: x
A158: 10155 | B158: x | C158: x
A159: 10156 | B159: x | C159: x
A160: 10157 | B160: x | C160: x
A161: 20001 | B161: 庄家：XX输了XX金豆，被爆下庄！ | C161: 游戏房间-坐庄
A162: 20002 | B162: 庄家：XX赢了XX金豆，5连赢，大杀四方下庄！ | C162: 游戏房间-坐庄
A163: 20003 | B163: 庄家：XX赢了XX金豆，4连赢，但求一爆！ | C163: 游戏房间-坐庄
A164: 20004 | B164: 庄家：XX赢了XX金豆，3连赢，但求一爆！ | C164: 游戏房间-坐庄
A165: 20005 | B165: 庄家：XX赢了XX金豆，2连赢，但求一爆！ | C165: 游戏房间-坐庄
A166: 20006 | B166: 庄家：XX赢了XX金豆，1连赢，但求一爆！ | C166: 游戏房间-坐庄
A167: 20007 | B167: 祝贺XX独得彩金XX金豆大奖！ | C167: 游戏房间-彩金
A168: 20008 | B168: 祝贺XX等获得彩金XX金豆大奖！ | C168: 游戏房间-彩金
A169: 20009 | B169: 确定后将退出游戏至大厅界面，确定退出！ | C169: 游戏房间-退至大厅
A170: 20010 | B170: x | C170: x
A171: 20011 | C171: x
A172: 20012 | C172: x
A173: 20013 | C173: x
A174: 20014 | C174: x
A175: 20015 | C175: x
A176: 20016 | C176: x
A177: 20017 | C177: x
A178: 20018 | C178: x
A179: 20019 | C179: x
A180: 20020 | C180: x
A181: 20021 | C181: x
A182: 20022 | C182: x
A183: 20023 | C183: x
A184: 20024 | C184: x
A185: 20025 | C185: x
A186: 20026 | C186: x
A187: 20027 | C187: x
A188: 20028 | C188: x
A189: 20029 | C189: x
A190: 20030 | C190: x
A191: 20031 | C191: x
A192: 20032 | C192: x
A193: 20033 | C193: x
A194: 20034 | C194: x
A195: 20035 | C195: x
A196: 20036 | C196: x
A197: 20037 | C197: x
A198: 20038 | C198: x
A199: 20039 | C199: x
A200: 20040 | C200: x
A201: 20041 | C201: x
A202: 20042 | C202: x

Sheet: recharge-zfb
A1: id | B1: 人民币 | C1: 金豆数量 | D1: 首次充值获得金豆数量 | E1: 说明 | F1: 充值获得奖券 | G1: 充值平台
A2: int | B2: double | C2: int | D2: int | E2: String | F2: int | G2: String
A3: id | B3: rmb | C3: jinDou | D3: jinDouFirst | E3: dsc | F3: jiangQuan | G3: plantform
A4: 1 | B4: 12 | C4: 12000 | D4: =RC[-1]*1 -> 12000 | E4: ="充值"&RC[-3]&"元,获得"&RC[-2]&"金豆" -> 充值12元,获得12000金豆 | F4: =RC[-3]/100 -> 120 | G4: 支付宝
A5: 2 | B5: 25 | C5: 27500 | D5: =RC[-1]*1 -> 27500 | E5: ="充值"&RC[-3]&"元,获得"&RC[-2]&"金豆" -> 充值25元,获得27500金豆 | F5: =RC[-3]/100 -> 275 | G5: 支付宝
A6: 3 | B6: 30 | C6: 33600 | D6: =RC[-1]*1 -> 33600 | E6: ="充值"&RC[-3]&"元,获得"&RC[-2]&"金豆" -> 充值30元,获得33600金豆 | F6: =RC[-3]/100 -> 336 | G6: 支付宝
A7: 4 | B7: 50 | C7: 57500 | D7: =RC[-1]*1 -> 57500 | E7: ="充值"&RC[-3]&"元,获得"&RC[-2]&"金豆" -> 充值50元,获得57500金豆 | F7: =RC[-3]/100 -> 575 | G7: 支付宝
A8: 5 | B8: 108 | C8: 129600 | D8: =RC[-1]*1 -> 129600 | E8: ="充值"&RC[-3]&"元,获得"&RC[-2]&"金豆" -> 充值108元,获得129600金豆 | F8: =RC[-3]/100 -> 1296 | G8: 支付宝
A9: 6 | B9: 518 | C9: 647500 | D9: =RC[-1]*1 -> 647500 | E9: ="充值"&RC[-3]&"元,获得"&RC[-2]&"金豆" -> 充值518元,获得647500金豆 | F9: =RC[-3]/100 -> 6475 | G9: 支付宝
A10: 7 | B10: 1048 | C10: 1362400 | D10: =RC[-1]*1 -> 1362400 | E10: ="充值"&RC[-3]&"元,获得"&RC[-2]&"金豆" -> 充值1048元,获得1362400金豆 | F10: =RC[-3]/100 -> 13624 | G10: 支付宝

Sheet: recharge-xy
A1: id | B1: id | C1: 人民币 | D1: 金豆数量 | E1: 首次充值获得金豆数量 | F1: 单位 | G1: 说明 | H1: 充值获得奖券 | I1: 充值平台
A2: int | B2: String | C2: double | D2: int | E2: int | F2: String | G2: String | H2: int | I2: String
A3: id | B3: appstore | C3: rmb | D3: jinDou | E3: jinDouFirst | F3: currency | G3: dsc | H3: jiangQuan | I3: plantform
A4: 1 | B4: jd12000 | C4: 12 | D4: 12000 | E4: =RC[-1]*1 -> 12000 | F4: 元 | G4: ="充值"&RC[-4]&"元获得"&RC[-3]&"金豆，赠送"&RC[1]&"兑奖卷！" -> 充值12元获得12000金豆，赠送120兑奖卷！ | H4: 120 | I4: XY
A5: 2 | B5: jd27500 | C5: 25 | D5: 27500 | E5: =RC[-1]*1 -> 27500 | F5: 元 | G5: ="充值"&RC[-4]&"元获得"&RC[-4]*1000&"金豆，额外赠送10%，总计"&RC[-3]&"金豆；赠送"&RC[1]&"兑奖卷！" -> 充值25元获得25000金豆，额外赠送10%，总计27500金豆；赠送275兑奖卷！ | H5: 275 | I5: XY
A6: 3 | B6: jd33600 | C6: 30 | D6: 33600 | E6: =RC[-1]*1 -> 33600 | F6: 元 | G6: ="充值"&RC[-4]&"元获得"&RC[-4]*1000&"金豆，额外赠送12%，总计"&RC[-3]&"金豆；赠送"&RC[1]&"兑奖卷！" -> 充值30元获得30000金豆，额外赠送12%，总计33600金豆；赠送336兑奖卷！ | H6: 336 | I6: XY
A7: 4 | B7: jd57500 | C7: 50 | D7: 57500 | E7: =RC[-1]*1 -> 57500 | F7: 元 | G7: ="充值"&RC[-4]&"元获得"&RC[-4]*1000&"金豆，额外赠送15%，总计"&RC[-3]&"金豆；赠送"&RC[1]&"兑奖卷！" -> 充值50元获得50000金豆，额外赠送15%，总计57500金豆；赠送575兑奖卷！ | H7: 575 | I7: XY
A8: 5 | B8: jd129600 | C8: 108 | D8: 129600 | E8: =RC[-1]*1 -> 129600 | F8: 元 | G8: ="充值"&RC[-4]&"元获得"&RC[-4]*1000&"金豆，额外赠送20%，总计"&RC[-3]&"金豆；赠送"&RC[1]&"兑奖卷！" -> 充值108元获得108000金豆，额外赠送20%，总计129600金豆；赠送1296兑奖卷！ | H8: 1296 | I8: XY
A9: 6 | B9: jd647500 | C9: 518 | D9: 647500 | E9: =RC[-1]*1 -> 647500 | F9: 元 | G9: ="充值"&RC[-4]&"元获得"&RC[-4]*1000&"金豆，额外赠送25%，总计"&RC[-3]&"金豆；赠送"&RC[1]&"兑奖卷！" -> 充值518元获得518000金豆，额外赠送25%，总计647500金豆；赠送6475兑奖卷！ | H9: 6475 | I9: XY
A10: 7 | B10: jd778680 | C10: 618 | D10: 778680 | E10: =RC[-1]*1 -> 778680 | F10: 元 | G10: ="充值"&RC[-4]&"元获得"&RC[-4]*1000&"金豆，额外赠送26%，总计"&RC[-3]&"金豆；赠送"&RC[1]&"兑奖卷！" -> 充值618元获得618000金豆，额外赠送26%，总计778680金豆；赠送7787兑奖卷！ | H10: 7787 | I10: XY

Sheet: recharge-yi-jie
A1: id | B1: 人民币 | C1: 金豆数量 | D1: 首次充值获得金豆数量 | E1: 说明 | F1: 充值获得奖券 | G1: 充值平台
A2: int | B2: double | C2: int | D2: int | E2: String | F2: int | G2: String
A3: id | B3: rmb | C3: jinDou | D3: jinDouFirst | E3: dsc | F3: jiangQuan | G3: plantform
A4: 1 | B4: 12 | C4: 12000 | D4: =RC[-1]*1 -> 12000 | E4: ="充值"&RC[-3]&"元,获得"&RC[-2]&"金豆" -> 充值12元,获得12000金豆 | F4: =RC[-3]/100 -> 120 | G4: 易接
A5: 2 | B5: 25 | C5: 27500 | D5: =RC[-1]*1 -> 27500 | E5: ="充值"&RC[-3]&"元,获得"&RC[-2]&"金豆" -> 充值25元,获得27500金豆 | F5: =RC[-3]/100 -> 275 | G5: 易接
A6: 3 | B6: 30 | C6: 33600 | D6: =RC[-1]*1 -> 33600 | E6: ="充值"&RC[-3]&"元,获得"&RC[-2]&"金豆" -> 充值30元,获得33600金豆 | F6: =RC[-3]/100 -> 336 | G6: 易接
A7: 4 | B7: 50 | C7: 57500 | D7: =RC[-1]*1 -> 57500 | E7: ="充值"&RC[-3]&"元,获得"&RC[-2]&"金豆" -> 充值50元,获得57500金豆 | F7: =RC[-3]/100 -> 575 | G7: 易接
A8: 5 | B8: 108 | C8: 129600 | D8: =RC[-1]*1 -> 129600 | E8: ="充值"&RC[-3]&"元,获得"&RC[-2]&"金豆" -> 充值108元,获得129600金豆 | F8: =RC[-3]/100 -> 1296 | G8: 易接
A9: 6 | B9: 518 | C9: 647500 | D9: =RC[-1]*1 -> 647500 | E9: ="充值"&RC[-3]&"元,获得"&RC[-2]&"金豆" -> 充值518元,获得647500金豆 | F9: =RC[-3]/100 -> 6475 | G9: 易接
A10: 7 | B10: 1048 | C10: 1362400 | D10: =RC[-1]*1 -> 1362400 | E10: ="充值"&RC[-3]&"元,获得"&RC[-2]&"金豆" -> 充值1048元,获得1362400金豆 | F10: =RC[-3]/100 -> 13624 | G10: 易接

Sheet: recharge-hua-fei
A1: id | B1: 人民币 | C1: 金豆数量 | D1: 说明 | E1: 充值获得奖券 | F1: 充值平台
A2: int | B2: double | C2: int | D2: String | E2: int | F2: String
A3: id | B3: rmb | C3: jinDou | D3: dsc | E3: jiangQuan | F3: plantform
A4: 1 | B4: 8 | C4: =500*RC[-1] -> 4000 | D4: ="充值"&RC[-2]&"元,获得"&RC[-1]&"金豆" -> 充值8元,获得4000金豆 | E4: =RC[-2]/100 -> 40 | F4: 话费充值
A5: 2 | B5: 6 | C5: =500*RC[-1] -> 3000 | D5: ="充值"&RC[-2]&"元,获得"&RC[-1]&"金豆" -> 充值6元,获得3000金豆 | E5: =RC[-2]/100 -> 30 | F5: 话费充值
A6: 3 | B6: 4 | C6: =500*RC[-1] -> 2000 | D6: ="充值"&RC[-2]&"元,获得"&RC[-1]&"金豆" -> 充值4元,获得2000金豆 | E6: =RC[-2]/100 -> 20 | F6: 话费充值
A7: 4 | B7: 2 | C7: =500*RC[-1] -> 1000 | D7: ="充值"&RC[-2]&"元,获得"&RC[-1]&"金豆" -> 充值2元,获得1000金豆 | E7: =RC[-2]/100 -> 10 | F7: 话费充值

Sheet: recharge-qi-ta
A1: id | B1: 人民币 | C1: 金豆数量 | D1: 首次充值获得金豆数量 | E1: 说明 | F1: 充值获得奖券 | G1: 充值平台
A2: int | B2: double | C2: int | D2: int | E2: String | F2: int | G2: String
A3: id | B3: rmb | C3: jinDou | D3: jinDouFirst | E3: dsc | F3: jiangQuan | G3: plantform
A4: 1 | B4: 1000 | C4: 1300000 | D4: =RC[-1]*1 -> 1300000 | E4: 充值1000元,获得1300000金豆 | F4: =RC[-3]/100 -> 13000 | G4: 其他
A5: 2 | B5: 500 | C5: 625000 | D5: =RC[-1]*1 -> 625000 | E5: 充值500元,获得625000金豆 | F5: =RC[-3]/100 -> 6250 | G5: 其他
A6: 3 | B6: 100 | C6: 120000 | D6: =RC[-1]*1 -> 120000 | E6: 充值100元,获得120000金豆 | F6: =RC[-3]/100 -> 1200 | G6: 其他
A7: 4 | B7: 50 | C7: 57500 | D7: =RC[-1]*1 -> 57500 | E7: 充值50元,获得57500金豆 | F7: =RC[-3]/100 -> 575 | G7: 其他
A8: 5 | B8: 30 | C8: 33600 | D8: =RC[-1]*1 -> 33600 | E8: 充值30元,获得33600金豆 | F8: =RC[-3]/100 -> 336 | G8: 其他
A9: 6 | B9: 20 | C9: 22000 | D9: =RC[-1]*1 -> 22000 | E9: 充值20元,获得22000金豆 | F9: =RC[-3]/100 -> 220 | G9: 其他
A10: 7 | B10: 10 | C10: 10000 | D10: =RC[-1]*1 -> 10000 | E10: 充值10元,获得10000金豆 | F10: =RC[-3]/100 -> 100 | G10: 其他

Sheet: recharge-appstore
A1: id | B1: id | C1: 人民币 | D1: 金豆数量 | E1: 首次充值获得金豆数量 | F1: 单位 | G1: 说明 | H1: 充值获得奖券 | I1: 充值平台
A2: int | B2: String | C2: double | D2: int | E2: int | F2: String | G2: String | H2: int | I2: String
A3: id | B3: appstore | C3: rmb | D3: jinDou | E3: jinDouFirst | F3: currency | G3: dsc | H3: jiangQuan | I3: plantform
A4: 1 | B4: jd12000 | C4: 12 | D4: 12000 | E4: =RC[-1]*1 -> 12000 | F4: 元 | G4: ="充值"&RC[-4]&"元获得"&RC[-3]&"金豆，赠送"&RC[1]&"兑奖卷！" -> 充值12元获得12000金豆，赠送120兑奖卷！ | H4: 120 | I4: 苹果
A5: 2 | B5: jd27500 | C5: 25 | D5: 27500 | E5: =RC[-1]*1 -> 27500 | F5: 元 | G5: ="充值"&RC[-4]&"元获得"&RC[-4]*1000&"金豆，额外赠送10%，总计"&RC[-3]&"金豆；赠送"&RC[1]&"兑奖卷！" -> 充值25元获得25000金豆，额外赠送10%，总计27500金豆；赠送275兑奖卷！ | H5: 275 | I5: 苹果
A6: 3 | B6: jd33600 | C6: 30 | D6: 33600 | E6: =RC[-1]*1 -> 33600 | F6: 元 | G6: ="充值"&RC[-4]&"元获得"&RC[-4]*1000&"金豆，额外赠送12%，总计"&RC[-3]&"金豆；赠送"&RC[1]&"兑奖卷！" -> 充值30元获得30000金豆，额外赠送12%，总计33600金豆；赠送336兑奖卷！ | H6: 336 | I6: 苹果
A7: 4 | B7: jd57500 | C7: 50 | D7: 57500 | E7: =RC[-1]*1 -> 57500 | F7: 元 | G7: ="充值"&RC[-4]&"元获得"&RC[-4]*1000&"金豆，额外赠送15%，总计"&RC[-3]&"金豆；赠送"&RC[1]&"兑奖卷！" -> 充值50元获得50000金豆，额外赠送15%，总计57500金豆；赠送575兑奖卷！ | H7: 575 | I7: 苹果
A8: 5 | B8: jd129600 | C8: 108 | D8: 129600 | E8: =RC[-1]*1 -> 129600 | F8: 元 | G8: ="充值"&RC[-4]&"元获得"&RC[-4]*1000&"金豆，额外赠送20%，总计"&RC[-3]&"金豆；赠送"&RC[1]&"兑奖卷！" -> 充值108元获得108000金豆，额外赠送20%，总计129600金豆；赠送1296兑奖卷！ | H8: 1296 | I8: 苹果
A9: 6 | B9: jd647500 | C9: 518 | D9: 647500 | E9: =RC[-1]*1 -> 647500 | F9: 元 | G9: ="充值"&RC[-4]&"元获得"&RC[-4]*1000&"金豆，额外赠送25%，总计"&RC[-3]&"金豆；赠送"&RC[1]&"兑奖卷！" -> 充值518元获得518000金豆，额外赠送25%，总计647500金豆；赠送6475兑奖卷！ | H9: 6475 | I9: 苹果
A10: 7 | B10: jd778680 | C10: 618 | D10: 778680 | E10: =RC[-1]*1 -> 778680 | F10: 元 | G10: ="充值"&RC[-4]&"元获得"&RC[-4]*1000&"金豆，额外赠送26%，总计"&RC[-3]&"金豆；赠送"&RC[1]&"兑奖卷！" -> 充值618元获得618000金豆，额外赠送26%，总计778680金豆；赠送7787兑奖卷！ | H10: 7787 | I10: 苹果

Sheet: marketplace
A1: id | B1: 物品ID | C1: 总价 | D1: 默认数量 | E1: 说明
A2: int | B2: int | C2: int | D2: int | E2: String
A3: id | B3: type | C3: priceAll | D3: count | E3: dsc
A4: 1 | B4: 10001 | C4: 10000 | D4: 1 | E4: 购买1个喇叭
A5: 2 | B5: 10001 | C5: 50000 | D5: 5 | E5: 购买5个喇叭
A6: 3 | B6: 10001 | C6: 200000 | D6: 20 | E6: 购买20个喇叭
A7: 4 | B7: 10001 | C7: 500000 | D7: 50 | E7: 购买50个喇叭

Sheet: goods
A1: id | B1: 物品ID | C1: 物品名字
A2: int | B2: int | C2: String
A3: type | B3: type | C3: name
A4: 10001 | B4: 10001 | C4: 喇叭

Sheet: huiBaoLv
A1: id | B1: 档位 | C1: 随机编号 | D1: 回报率(麻烦策划填) | E1: 说明
A2: String | B2: int | C2: int | D2: double | E2: String
A3: id | B3: dangWei | C3: randomNumber | D3: huiBaoLv | E3: dsc
A4: =RC[1]&"-"&RC[2] -> 1-1 | B4: 1 | C4: 1 | D4: 0.838679245 | E4: 兔子
A5: =RC[1]&"-"&RC[2] -> 1-2 | B5: 1 | C5: 2 | D5: 0.838679245 | E5: 兔子
A6: =RC[1]&"-"&RC[2] -> 1-3 | B6: 1 | C6: 3 | D6: 0.838679245 | E6: 兔子
A7: =RC[1]&"-"&RC[2] -> 1-4 | B7: 1 | C7: 4 | D7: 0.838679245 | E7: 兔子
A8: =RC[1]&"-"&RC[2] -> 1-5 | B8: 1 | C8: 5 | D8: 0.838679245 | E8: 兔子
A9: =RC[1]&"-"&RC[2] -> 2-1 | B9: 2 | C9: 1 | D9: 0.838679245 | E9: 燕子
A10: =RC[1]&"-"&RC[2] -> 2-2 | B10: 2 | C10: 2 | D10: 0.838679245 | E10: 燕子
A11: =RC[1]&"-"&RC[2] -> 2-3 | B11: 2 | C11: 3 | D11: 0.838679245 | E11: 燕子
A12: =RC[1]&"-"&RC[2] -> 2-4 | B12: 2 | C12: 4 | D12: 0.838679245 | E12: 燕子
A13: =RC[1]&"-"&RC[2] -> 2-5 | B13: 2 | C13: 5 | D13: 0.838679245 | E13: 燕子
A14: =RC[1]&"-"&RC[2] -> 3-1 | B14: 3 | C14: 1 | D14: 0.854807692 | E14: 猴子
A15: =RC[1]&"-"&RC[2] -> 3-2 | B15: 3 | C15: 2 | D15: 0.854807692 | E15: 猴子
A16: =RC[1]&"-"&RC[2] -> 3-3 | B16: 3 | C16: 3 | D16: 0.854807692 | E16: 猴子
A17: =RC[1]&"-"&RC[2] -> 3-4 | B17: 3 | C17: 4 | D17: 0.854807692 | E17: 猴子
A18: =RC[1]&"-"&RC[2] -> 3-5 | B18: 3 | C18: 5 | D18: 0.854807692 | E18: 猴子
A19: =RC[1]&"-"&RC[2] -> 4-1 | B19: 4 | C19: 1 | D19: 0.854807692 | E19: 鸽子
A20: =RC[1]&"-"&RC[2] -> 4-2 | B20: 4 | C20: 2 | D20: 0.854807692 | E20: 鸽子
A21: =RC[1]&"-"&RC[2] -> 4-3 | B21: 4 | C21: 3 | D21: 0.854807692 | E21: 鸽子
A22: =RC[1]&"-"&RC[2] -> 4-4 | B22: 4 | C22: 4 | D22: 0.854807692 | E22: 鸽子
A23: =RC[1]&"-"&RC[2] -> 4-5 | B23: 4 | C23: 5 | D23: 0.854807692 | E23: 鸽子
A24: =RC[1]&"-"&RC[2] -> 5-1 | B24: 5 | C24: 1 | D24: 0.854807692 | E24: 熊猫
A25: =RC[1]&"-"&RC[2] -> 5-2 | B25: 5 | C25: 2 | D25: 0.854807692 | E25: 熊猫
A26: =RC[1]&"-"&RC[2] -> 5-3 | B26: 5 | C26: 3 | D26: 0.854807692 | E26: 熊猫
A27: =RC[1]&"-"&RC[2] -> 5-4 | B27: 5 | C27: 4 | D27: 0.854807692 | E27: 熊猫
A28: =RC[1]&"-"&RC[2] -> 5-5 | B28: 5 | C28: 5 | D28: 0.854807692 | E28: 熊猫
A29: =RC[1]&"-"&RC[2] -> 6-1 | B29: 6 | C29: 1 | D29: 0.854807692 | E29: 孔雀
A30: =RC[1]&"-"&RC[2] -> 6-2 | B30: 6 | C30: 2 | D30: 0.854807692 | E30: 孔雀
A31: =RC[1]&"-"&RC[2] -> 6-3 | B31: 6 | C31: 3 | D31: 0.854807692 | E31: 孔雀
A32: =RC[1]&"-"&RC[2] -> 6-4 | B32: 6 | C32: 4 | D32: 0.854807692 | E32: 孔雀
A33: =RC[1]&"-"&RC[2] -> 6-5 | B33: 6 | C33: 5 | D33: 0.854807692 | E33: 孔雀
A34: =RC[1]&"-"&RC[2] -> 7-1 | B34: 7 | C34: 1 | D34: 0.858163265 | E34: 正常
A35: =RC[1]&"-"&RC[2] -> 7-2 | B35: 7 | C35: 2 | D35: 0.858163265 | E35: 正常
A36: =RC[1]&"-"&RC[2] -> 7-3 | B36: 7 | C36: 3 | D36: 0.858163265 | E36: 正常
A37: =RC[1]&"-"&RC[2] -> 7-4 | B37: 7 | C37: 4 | D37: 0.858163265 | E37: 正常
A38: =RC[1]&"-"&RC[2] -> 7-5 | B38: 7 | C38: 5 | D38: 0.858163265 | E38: 正常
A39: =RC[1]&"-"&RC[2] -> 8-1 | B39: 8 | C39: 1 | D39: 0.871568627 | E39: 狮子
A40: =RC[1]&"-"&RC[2] -> 8-2 | B40: 8 | C40: 2 | D40: 0.871568627 | E40: 狮子
A41: =RC[1]&"-"&RC[2] -> 8-3 | B41: 8 | C41: 3 | D41: 0.871568627 | E41: 狮子
A42: =RC[1]&"-"&RC[2] -> 8-4 | B42: 8 | C42: 4 | D42: 0.871568627 | E42: 狮子
A43: =RC[1]&"-"&RC[2] -> 8-5 | B43: 8 | C43: 5 | D43: 0.871568627 | E43: 狮子
A44: =RC[1]&"-"&RC[2] -> 9-1 | B44: 9 | C44: 1 | D44: 0.871568627 | E44: 老鹰
A45: =RC[1]&"-"&RC[2] -> 9-2 | B45: 9 | C45: 2 | D45: 0.871568627 | E45: 老鹰
A46: =RC[1]&"-"&RC[2] -> 9-3 | B46: 9 | C46: 3 | D46: 0.871568627 | E46: 老鹰
A47: =RC[1]&"-"&RC[2] -> 9-4 | B47: 9 | C47: 4 | D47: 0.871568627 | E47: 老鹰
A48: =RC[1]&"-"&RC[2] -> 9-5 | B48: 9 | C48: 5 | D48: 0.871568627 | E48: 老鹰

Sheet: translate
A1: 键 | B1: 值
A2: String | B2: String
A3: key | B3: value
A4: SetUserAction\.setUser | B4: <font color="#007700">修改用户数据</font>
A5: MustGenerateAction\.mustGenerate | B5: <font color="#007700">本轮必出</font>
A6: ReloadConfigAction\.reloadConfig | B6: <font color="#007700">重新加载系统配置</font>
A7: SetSystemInfoAction\.setSystemInfo | B7: <font color="#007700">修改系统配置</font>
A8: Turntable\$GenerateResultTask\.settlementForAllRoles | B8: <font color="#007700">结算金豆</font>
A9: Turntable\$RobotTask\.runSafty | B9: <font color="#007700">机器人下注</font>
A10: Turntable\$GenerateResultTask\.runSafty | B10: <font color="#007700">生成结果</font>
A11: AbstractJsonAction\.execute\|http://[0-9\\.:]+/vgame-a/turntable/synchronizeData | B11: <font color="#007700">提交结果</font>
A12: AbstractJsonAction\.execute\|http://[0-9\\.:]+/vgame-a/message/getMessages | B12: <font color="#007700">获取聊天消息</font>
A13: AbstractJsonAction\.execute\|http://[0-9\\.:]+/vgame-a/turntable/getPlayResult | B13: <font color="#007700">获取开奖结果</font>
A14: InitThread\.printSucessfulMessage | B14: <font color="#007700">启动日志</font>
A15: Turntable\$RoundEndTask\.runSafty\|round end | B15: <font color="#007700">回合结束</font>
A16: AbstractJsonAction\.execute\|http://[0-9\\.:]+/vgame-a/account/enterServer | B16: <font color="#007700">进入游戏</font>
A17: AbstractJsonAction\.execute\|http://[0-9\\.:]+/vgame-a/turntable/toBank | B17: <font color="#007700">存银行</font>
A18: AbstractJsonAction\.execute\|http://[0-9\\.:]+/vgame-a/turntable/fromBank | B18: <font color="#007700">取钱</font>
A19: AbstractJsonAction\.execute\|http://[0-9\\.:]+/vgame-a/receivecoin/receivecoin | B19: <font color="#007700">领取金豆</font>
A20: AbstractJsonAction\.execute\|http://[0-9\\.:]+/vgame-a/turntable/getUserData | B20: <font color="#007700">获取用户数据</font>
A21: AbstractJsonAction\.execute\|http://[0-9\\.:]+/vgame-a/account/selectRole | B21: <font color="#007700">选定角色</font>
A22: AbstractJsonAction\.execute\|http://[0-9\\.:]+/vgame-a/account/getRoleList | B22: <font color="#007700">获取角色列表</font>
A23: AbstractJsonAction\.execute\|http://[0-9\\.:]+/vgame-a/turntable/getRankingList | B23: <font color="#007700">获取排行榜</font>
A24: Turntable\$GenerateResultTask\.runSafty | B24: <font color="#770000">重置游戏</font>
A25: Turntable\$RobotTask\.runSafty | B25: <font color="#770000">机器人</font>
A26: Turntable\$GenerateResultTask\.settlementForAllRoles | B26: <font color="#770000">结算</font>
A27: Turntable\$RoundEndTask\.runSafty | B27: <font color="#770000">回合结束</font>
A28: RankingList\.<init> | B28: <font color="#770000">排行榜初始化</font>
A29: InitThread\.printSucessfulMessage | B29: <font color="#770000">服务器初始化</font>
A30: Turntable\.addRobotTask | B30: <font color="#770000">服务器任务初始化</font>
A31: RobotManager\.loadFromDb | B31: <font color="#770000">加载机器人</font>
A32: InitThread\.initGameXml | B32: <font color="#770000">初始化系统配置表</font>